"SDOH Category","Resource","Resource Element","Code System","Code","Description","Grouping","Definition","Is Panel Code","Is Multiselect"
"Material Hardship","Procedure","Procedure.code","Gravity","IS-65","Evaluation of eligibility for Head Start","Evaluation of eligiblity","Process of determining eligibility by evaluating evidence","",""
"Financial Insecurity","Procedure","Procedure.code","Gravity","IS-73","Evaluation of eligibility for Health Insurance Navigator","Evaluation of eligiblity","Process of determining eligibility by evaluating evidence","",""
"Inadequate Housing","Procedure","Procedure.code","Gravity","IS-103","Evaluation of eligibility for healthcare program for homeless","Evaluation of eligiblity","Process of determining eligibility by evaluating evidence","",""
"Inadequate Housing","Procedure","Procedure.code","Gravity","IS-29","Evaluation of eligibility for Home improvement/repair loan and grant programs","Evaluation of eligiblity","Process of determining eligibility by evaluating evidence","",""
"Inadequate Housing","Procedure","Procedure.code","Gravity","IS-41","Evaluation of eligibility for Home repair program","Evaluation of eligiblity","Process of determining eligibility by evaluating evidence","",""
"Inadequate Housing","Procedure","Procedure.code","Gravity","IS-28","Evaluation of eligibility for Homelessness Prevention program","Evaluation of eligiblity","Process of determining eligibility by evaluating evidence","",""
"Inadequate Housing","Procedure","Procedure.code","Unknown","N/A","Evaluation of eligibility for homelessness prevention programs","Evaluation of eligiblity","Process of determining eligibility by evaluating evidence","",""
"Inadequate Housing","Procedure","Procedure.code","Gravity","IS-47","Evaluation of eligibility for Housing Only program","Evaluation of eligiblity","Process of determining eligibility by evaluating evidence","",""
"Inadequate Housing","Procedure","Procedure.code","Gravity","IS-24","Evaluation of eligibility for housing support programs","Evaluation of eligiblity","Process of determining eligibility by evaluating evidence","",""
"Inadequate Housing","Procedure","Procedure.code","Gravity","IS-44","Evaluation of eligibility for Housing with Services program (no disability required for entry)","Evaluation of eligiblity","Process of determining eligibility by evaluating evidence","",""
"Material Hardship","Procedure","Procedure.code","Gravity","IS-76","Evaluation of eligibility for Internet Assistance Program","Evaluation of eligiblity","Process of determining eligibility by evaluating evidence","",""
"Employment Status","Procedure","Procedure.code","Unknown","N/A","Evaluation of eligibility for job development (training and employment programs)","Evaluation of eligiblity","Process of determining eligibility by evaluating evidence","",""
"Financial Insecurity","Procedure","Procedure.code","Gravity","IS-53","Evaluation of eligibility for Job development (training and employment programs)","Evaluation of eligiblity","Process of determining eligibility by evaluating evidence","",""
"Financial Insecurity","Procedure","Procedure.code","Gravity","IS-52","Evaluation of eligibility for Job Finding Assistance Program","Evaluation of eligiblity","Process of determining eligibility by evaluating evidence","",""
"Employment Status","Procedure","Procedure.code","Unknown","N/A","Evaluation of eligibility for Job Finding Assistance Programs","Evaluation of eligiblity","Process of determining eligibility by evaluating evidence","",""
"Employment Status","Procedure","Procedure.code","Unknown","N/A","Evaluation of eligibility for legal aid","Evaluation of eligiblity","Process of determining eligibility by evaluating evidence","",""
"Inadequate Housing","Procedure","Procedure.code","Unknown","N/A","Evaluation of eligibility for legal aid programs","Evaluation of eligiblity","Process of determining eligibility by evaluating evidence","",""
"Material Hardship","Procedure","Procedure.code","Gravity","IS-72","Evaluation of eligibility for Lifeline Wireless Program","Evaluation of eligiblity","Process of determining eligibility by evaluating evidence","",""
"Material Hardship","Procedure","Procedure.code","Gravity","IS-53","Evaluation of eligibility for Low Income Home Energy Assistance Program (LIHEAP)","Evaluation of eligiblity","Process of determining eligibility by evaluating evidence","",""
"Transportation Insecurity","Procedure","Procedure.code","Gravity","IS-49","Evaluation of eligibility for Medicaid Transportation Program","Evaluation of eligiblity","Process of determining eligibility by evaluating evidence","",""
"Inadequate Housing","Procedure","Procedure.code","Gravity","IS-74","Evaluation of eligibility for medical respite for homeless","Evaluation of eligiblity","Process of determining eligibility by evaluating evidence","",""
"Transportation Insecurity","Procedure","Procedure.code","Gravity","IS-67","Evaluation of eligibility for Micro-Transit Program","Evaluation of eligiblity","Process of determining eligibility by evaluating evidence","",""
"Financial Insecurity","Procedure","Procedure.code","Gravity","IS-56","Evaluation of eligibility for Microenterprise development/support","Evaluation of eligiblity","Process of determining eligibility by evaluating evidence","",""
"Employment Status","Procedure","Procedure.code","Unknown","N/A","Evaluation of eligibility for microenterprise development/support grants","Evaluation of eligiblity","Process of determining eligibility by evaluating evidence","",""
"Inadequate Housing","Procedure","Procedure.code","Gravity","IS-99","Evaluation of eligibility for mortgage assistance","Evaluation of eligiblity","Process of determining eligibility by evaluating evidence","",""
"Transportation Insecurity","Procedure","Procedure.code","Gravity","IS-45","Evaluation of eligibility for Para-transit Program","Evaluation of eligiblity","Process of determining eligibility by evaluating evidence","",""
"Inadequate Housing","Procedure","Procedure.code","Gravity","IS-42","Evaluation of eligibility for Permanent Supportive Housing program (disability required for entry)","Evaluation of eligiblity","Process of determining eligibility by evaluating evidence","",""
"Financial Insecurity","Procedure","Procedure.code","Gravity","IS-57","Evaluation of eligibility for Prescription Assistance Program","Evaluation of eligiblity","Process of determining eligibility by evaluating evidence","",""
"Material Hardship","Procedure","Procedure.code","Gravity","IS-32","Evaluation of eligibility for prescription assistance program","Evaluation of eligiblity","Process of determining eligibility by evaluating evidence","",""
"Employment Status","Procedure","Procedure.code","Unknown","N/A","Evaluation of eligibility for Prescription Assistance Programs","Evaluation of eligiblity","Process of determining eligibility by evaluating evidence","",""
"Inadequate Housing","Procedure","Procedure.code","Gravity","IS-40","Evaluation of eligibility for Rapid Re-Housing program","Evaluation of eligiblity","Process of determining eligibility by evaluating evidence","",""
"Inadequate Housing","Procedure","Procedure.code","Gravity","IS-64","Evaluation of eligibility for rental assistance","Evaluation of eligiblity","Process of determining eligibility by evaluating evidence","",""
"Financial Insecurity","Procedure","Procedure.code","Gravity","IS-72","Evaluation of eligibility for Representative Payee Program","Evaluation of eligiblity","Process of determining eligibility by evaluating evidence","",""
"Employment Status","Procedure","Procedure.code","Unknown","N/A","Evaluation of eligibility for Representative Payee Programs","Evaluation of eligiblity","Process of determining eligibility by evaluating evidence","",""
"Transportation Insecurity","Procedure","Procedure.code","Gravity","IS-63","Evaluation of eligibility for Ridesharing Program","Evaluation of eligiblity","Process of determining eligibility by evaluating evidence","",""
"Inadequate Housing","Procedure","Procedure.code","Gravity","IS-38","Evaluation of eligibility for Safe Haven program","Evaluation of eligiblity","Process of determining eligibility by evaluating evidence","",""
"Financial Insecurity","Procedure","Procedure.code","Gravity","IS-68","Evaluation of eligibility for Special supplemental nutrition program for women, infants, and children (WIC) program","Evaluation of eligiblity","Process of determining eligibility by evaluating evidence","",""
"Employment Status","Procedure","Procedure.code","Unknown","N/A","Evaluation of eligibility for special supplemental nutrition program for women, infants, and children (WIC) programs","Evaluation of eligiblity","Process of determining eligibility by evaluating evidence","",""
"Inadequate Housing","Procedure","Procedure.code","Gravity","IS-30","Evaluation of eligibility for Street Outreach program","Evaluation of eligiblity","Process of determining eligibility by evaluating evidence","",""
"Inadequate Housing","Procedure","Procedure.code","Gravity","IS-86","Evaluation of eligibility for subsidized housing","Evaluation of eligiblity","Process of determining eligibility by evaluating evidence","",""
"Financial Insecurity","Procedure","Procedure.code","Gravity","IS-63","Evaluation of eligibility for Supplemental Nutrition Assistance Program (SNAP)","Evaluation of eligiblity","Process of determining eligibility by evaluating evidence","",""
"Employment Status","Procedure","Procedure.code","Unknown","N/A","Evaluation of eligibility for Supplemental Security Income (SSI) Program","Evaluation of eligiblity","Process of determining eligibility by evaluating evidence","",""
"Financial Insecurity","Procedure","Procedure.code","Gravity","IS-65","Evaluation of eligibility for Supplemental Security Income (SSI) Program","Evaluation of eligiblity","Process of determining eligibility by evaluating evidence","",""
"Transportation Insecurity","Procedure","Procedure.code","Gravity","IS-58","Evaluation of eligibility for Taxi/Ride Hailing Voucher Program","Evaluation of eligiblity","Process of determining eligibility by evaluating evidence","",""
"Material Hardship","Procedure","Procedure.code","Gravity","IS-80","Evaluation of eligibility for Telephone Assistance Program","Evaluation of eligiblity","Process of determining eligibility by evaluating evidence","",""
"Employment Status","Procedure","Procedure.code","Unknown","N/A","Evaluation of eligibility for Temporary Financial Assistance","Evaluation of eligiblity","Process of determining eligibility by evaluating evidence","",""
"Financial Insecurity","Procedure","Procedure.code","Gravity","IS-58","Evaluation of eligibility for Temporary Financial Assistance","Evaluation of eligiblity","Process of determining eligibility by evaluating evidence","",""
"Financial Insecurity","Procedure","Procedure.code","Gravity","IS-62","Evaluation of eligibility for Temporary Financial Assistance for Needy Families (TANF) Program","Evaluation of eligiblity","Process of determining eligibility by evaluating evidence","",""
"Employment Status","Procedure","Procedure.code","Unknown","N/A","Evaluation of eligibility for the Supplemental Nutrition Assistance Program (SNAP)","Evaluation of eligiblity","Process of determining eligibility by evaluating evidence","",""
"Employment Status","Procedure","Procedure.code","Unknown","N/A","Evaluation of eligibility for the Temporary Financial Assistance for Needy Families (TANF) Program","Evaluation of eligiblity","Process of determining eligibility by evaluating evidence","",""
"Employment Status","Procedure","Procedure.code","Unknown","N/A","Evaluation of eligibility for the Veteran Assistance Benefits Program","Evaluation of eligiblity","Process of determining eligibility by evaluating evidence","",""
"Employment Status","Procedure","Procedure.code","Unknown","N/A","Evaluation of eligibility for the Vocational Rehab Program","Evaluation of eligiblity","Process of determining eligibility by evaluating evidence","",""
"Inadequate Housing","Procedure","Procedure.code","Gravity","IS-34","Evaluation of eligibility for Transitional Housing program","Evaluation of eligiblity","Process of determining eligibility by evaluating evidence","",""
"Transportation Insecurity","Procedure","Procedure.code","Gravity","IS-79","Evaluation of eligibility for Transportation Network Companies (Ride Hailing) Program","Evaluation of eligiblity","Process of determining eligibility by evaluating evidence","",""
"Transportation Insecurity","Procedure","Procedure.code","Gravity","IS-24","Evaluation of eligibility for transportation support programs","Evaluation of eligiblity","Process of determining eligibility by evaluating evidence","",""
"Financial Insecurity","Procedure","Procedure.code","Gravity","IS-66","Evaluation of eligibility for Unemployment Benefit Program","Evaluation of eligiblity","Process of determining eligibility by evaluating evidence","",""
"Employment Status","Procedure","Procedure.code","Unknown","N/A","Evaluation of eligibility for unemployment benefits","Evaluation of eligiblity","Process of determining eligibility by evaluating evidence","",""
"Material Hardship","Procedure","Procedure.code","Gravity","IS-61","Evaluation of eligibility for utility assistance program","Evaluation of eligiblity","Process of determining eligibility by evaluating evidence","",""
"Financial Insecurity","Procedure","Procedure.code","Gravity","IS-67","Evaluation of eligibility for Veteran Assistance Benefits Program","Evaluation of eligiblity","Process of determining eligibility by evaluating evidence","",""
"Financial Insecurity","Procedure","Procedure.code","Gravity","IS-54","Evaluation of eligibility for Vocational Rehab Program","Evaluation of eligiblity","Process of determining eligibility by evaluating evidence","",""
"Transportation Insecurity","Procedure","Procedure.code","Gravity","IS-83","Evaluation of eligibility for Volunteer Driver Program","Evaluation of eligiblity","Process of determining eligibility by evaluating evidence","",""
"Material Hardship","Procedure","Procedure.code","Gravity","IS-68","Evaluation of eligibility for weatherization program","Evaluation of eligiblity","Process of determining eligibility by evaluating evidence","",""
"Inadequate Housing","Procedure","Procedure.code","Gravity","IS-33","Evaluation of eligibility for Weatherization programs","Evaluation of eligiblity","Process of determining eligibility by evaluating evidence","",""
"Employment Status","Procedure","Procedure.code","Gravity","IS-2","Evaluation of eligiblity for unemployement benefits","Evaluation of eligiblity","Process of determining eligibility by evaluating evidence","",""
"Transportation Insecurity","Procedure","Procedure.code","Gravity","IS-53","Evaluation of legibility for Public Transportation Voucher Program","Evaluation of eligiblity","Process of determining eligibility by evaluating evidence","",""
"Food Insecurity","Procedure","Procedure.code","Gravity","I-64","Evaluation of progress toward goals","Evaluation of eligiblity","Process of determining eligibility by evaluating evidence","",""
"Inadequate Housing","Procedure","Procedure.code","Gravity","IS-14","Evaluation of progress toward goals to achieve adequate housing","Evaluation of eligiblity","Process of determining eligibility by evaluating evidence","",""
"Financial Insecurity","Procedure","Procedure.code","Gravity","IS-1","Evaluation of progress toward goals to achieve financial security","Evaluation of eligiblity","Process of determining eligibility by evaluating evidence","",""
"Financial Insecurity","Procedure","Procedure.code","Gravity","IS-17","Health Risk Assessment","Assessment","Determination of a value, conclusion, or inference by evaluating evidence","",""
"Employment Status","Procedure","Procedure.code","Unknown","N/A","Health Risk Assessment (Managed Care Organization)","Assessment","Determination of a value, conclusion, or inference by evaluating evidence","",""
"Employment Status","Procedure","Procedure.code","Unknown","N/A","Provision of a child care assistance program","Provision","To supply/make available for use","",""
"Employment Status","Procedure","Procedure.code","Unknown","N/A","Provision of a Financial Loan Counseling Program","Provision","To supply/make available for use","",""
"Employment Status","Procedure","Procedure.code","Unknown","N/A","Provision of a General Relief Program","Provision","To supply/make available for use","",""
"Employment Status","Procedure","Procedure.code","Unknown","N/A","Provision of a Job Finding Assistance Program","Provision","To supply/make available for use","",""
"Employment Status","Procedure","Procedure.code","Unknown","N/A","Provision of a Vocational Rehab Program","Provision","To supply/make available for use","",""
"Inadequate Housing","Procedure","Procedure.code","Unknown","N/A","Provision of abatement","Provision","To supply/make available for use","",""
"Employment Status","Procedure","Procedure.code","Unknown","N/A","Provision of an Employment Legal Aid Program","Provision","To supply/make available for use","",""
"Inadequate Housing","Procedure","Procedure.code","Unknown","N/A","Provision of benefit enrollment assistance","Provision","To supply/make available for use","",""
"Employment Status","Procedure","Procedure.code","Unknown","N/A","Provision of Benefit Enrollment Assistance Programs","Provision","To supply/make available for use","",""
"Employment Status","Procedure","Procedure.code","Unknown","N/A","Provision of car share programs","Provision","To supply/make available for use","",""
"Inadequate Housing","Procedure","Procedure.code","Unknown","N/A","Provision of community resource assistance","Provision","To supply/make available for use","",""
"Employment Status","Procedure","Procedure.code","Unknown","N/A","Provision of community resource assistance","Provision","To supply/make available for use","",""
"Employment Status","Procedure","Procedure.code","Unknown","N/A","Provision of Earned Income Tax Credit & Tax Preparation Assistance","Provision","To supply/make available for use","",""
"Inadequate Housing","Procedure","Procedure.code","Gravity","IS-55","Provision of emergency housing funds","Provision","To supply/make available for use","",""
"Inadequate Housing","Procedure","Procedure.code","Unknown","N/A","Provision of environmental hazard testing","Provision","To supply/make available for use","",""
"Inadequate Housing","Procedure","Procedure.code","Gravity","IS-60","Provision of federal project based rental assistance voucher","Provision","To supply/make available for use","",""
"Inadequate Housing","Procedure","Procedure.code","Gravity","IS-59","Provision of federal tenant based rental assistance voucher","Provision","To supply/make available for use","",""
"Employment Status","Procedure","Procedure.code","Unknown","N/A","Provision of financial counseling","Provision","To supply/make available for use","",""
"Transportation Insecurity","Procedure","Procedure.code","Gravity","IS-37","Provision of gas voucher","Provision","To supply/make available for use","",""
"Employment Status","Procedure","Procedure.code","Unknown","N/A","Provision of Health Insurance Navigators","Provision","To supply/make available for use","",""
"Inadequate Housing","Procedure","Procedure.code","Unknown","N/A","Provision of home improvement/repair loans or grants","Provision","To supply/make available for use","",""
"Inadequate Housing","Procedure","Procedure.code","Gravity","IS-70","Provision of housing support","Provision","To supply/make available for use","",""
"Food Insecurity","Procedure","Procedure.code","Gravity","I-91","Provision of infant formula prescription","Provision","To supply/make available for use","",""
"Employment Status","Procedure","Procedure.code","Unknown","N/A","Provision of job development programs","Provision","To supply/make available for use","",""
"Inadequate Housing","Procedure","Procedure.code","Unknown","N/A","Provision of legal aid","Provision","To supply/make available for use","",""
"Employment Status","Procedure","Procedure.code","Unknown","N/A","Provision of Legal Aid","Provision","To supply/make available for use","",""
"Inadequate Housing","Procedure","Procedure.code","Unknown","N/A","Provision of medical-legal partnership assistance","Provision","To supply/make available for use","",""
"Employment Status","Procedure","Procedure.code","Unknown","N/A","Provision of microenterprise development/support","Provision","To supply/make available for use","",""
"Inadequate Housing","Procedure","Procedure.code","Gravity","IS-97","Provision of mortgage assistance","Provision","To supply/make available for use","",""
"Inadequate Housing","Procedure","Procedure.code","Gravity","IS-58","Provision of non-federal rental assistance voucher","Provision","To supply/make available for use","",""
"Material Hardship","Procedure","Procedure.code","Gravity","IS-34","Provision of prescription voucher","Provision","To supply/make available for use","",""
"Transportation Insecurity","Procedure","Procedure.code","Gravity","IS-54","Provision of Public Transportation Voucher","Provision","To supply/make available for use","",""
"Inadequate Housing","Procedure","Procedure.code","Gravity","IS-51","Provision of rental assistance voucher","Provision","To supply/make available for use","",""
"Transportation Insecurity","Procedure","Procedure.code","Gravity","IS-59","Provision of Taxi/Ride Hailing Voucher","Provision","To supply/make available for use","",""
"Transportation Insecurity","Procedure","Procedure.code","Gravity","IS-13","Provision of transportation support","Provision","To supply/make available for use","",""
"Inadequate Housing","Procedure","Procedure.code","Unknown","N/A","Provision of weatherization","Provision","To supply/make available for use","",""
"Material Hardship","Procedure","Procedure.code","Gravity","IS-81","Referral to Telephone Assistance Program","Provision","To supply/make available for use","",""
"Inadequate Housing","Procedure","Procedure.code","Gravity","IS-46","Referral for Coordinated Entry program","Referral","The act of clinicians/providers sending or directing a patient to healthcare professionals and/or programs for services (e.g., evaluation, treatment, aid, information, etc)","",""
"Employment Status","Procedure","Procedure.code","Unknown","N/A","Referral to a Benefit Enrollment Assistance Program","Referral","The act of clinicians/providers sending or directing a patient to healthcare professionals and/or programs for services (e.g., evaluation, treatment, aid, information, etc)","",""
"Employment Status","Procedure","Procedure.code","Unknown","N/A","Referral to a Case Manager","Referral","The act of clinicians/providers sending or directing a patient to healthcare professionals and/or programs for services (e.g., evaluation, treatment, aid, information, etc)","",""
"Employment Status","Procedure","Procedure.code","Unknown","N/A","Referral to a Child Care Assistance Program","Referral","The act of clinicians/providers sending or directing a patient to healthcare professionals and/or programs for services (e.g., evaluation, treatment, aid, information, etc)","",""
"Employment Status","Procedure","Procedure.code","Unknown","N/A","Referral to a community resource network","Referral","The act of clinicians/providers sending or directing a patient to healthcare professionals and/or programs for services (e.g., evaluation, treatment, aid, information, etc)","",""
"Employment Status","Procedure","Procedure.code","Unknown","N/A","Referral to a Financial Counseling/Literacy program","Referral","The act of clinicians/providers sending or directing a patient to healthcare professionals and/or programs for services (e.g., evaluation, treatment, aid, information, etc)","",""
"Employment Status","Procedure","Procedure.code","Unknown","N/A","Referral to a Financial Loan Counseling Program","Referral","The act of clinicians/providers sending or directing a patient to healthcare professionals and/or programs for services (e.g., evaluation, treatment, aid, information, etc)","",""
"Employment Status","Procedure","Procedure.code","Unknown","N/A","Referral to a General Relief Program","Referral","The act of clinicians/providers sending or directing a patient to healthcare professionals and/or programs for services (e.g., evaluation, treatment, aid, information, etc)","",""
"Employment Status","Procedure","Procedure.code","Unknown","N/A","Referral to a Health Insurance Navigator","Referral","The act of clinicians/providers sending or directing a patient to healthcare professionals and/or programs for services (e.g., evaluation, treatment, aid, information, etc)","",""
"Employment Status","Procedure","Procedure.code","Unknown","N/A","Referral to a job development program","Referral","The act of clinicians/providers sending or directing a patient to healthcare professionals and/or programs for services (e.g., evaluation, treatment, aid, information, etc)","",""
"Employment Status","Procedure","Procedure.code","Unknown","N/A","Referral to a Job Finding Assistance Program","Referral","The act of clinicians/providers sending or directing a patient to healthcare professionals and/or programs for services (e.g., evaluation, treatment, aid, information, etc)","",""
"Inadequate Housing","Procedure","Procedure.code","Unknown","N/A","Referral to a legal aid program","Referral","The act of clinicians/providers sending or directing a patient to healthcare professionals and/or programs for services (e.g., evaluation, treatment, aid, information, etc)","",""
"Employment Status","Procedure","Procedure.code","Unknown","N/A","Referral to a legal aid program","Referral","The act of clinicians/providers sending or directing a patient to healthcare professionals and/or programs for services (e.g., evaluation, treatment, aid, information, etc)","",""
