"SDOH Category","Resource","Resource Element","Code System","Code","Description","Grouping","Definition","Is Panel Code","Is Multiselect"
"Food Insecurity","ServiceRequest","ServiceRequest.code","SNOMED CT US","464091000124102","Referral to medically tailored meal program (procedure)","","","",""
"Food Insecurity","ServiceRequest","ServiceRequest.code","SNOMED CT US","441311000124102","Counseling about nutrition using stress management strategy (procedure)","","","",""
"Food Insecurity","ServiceRequest","ServiceRequest.code","SNOMED CT US","464071000124103","Referral to garden program (procedure)","","","",""
"Food Insecurity","ServiceRequest","ServiceRequest.code","SNOMED CT US","464251000124105","Education about congregate meal program (procedure)","","","",""
"Food Insecurity","ServiceRequest","ServiceRequest.code","SNOMED CT US","464051000124108","Referral to Gus Schumacher Nutrition Incentive Program (procedure)","","","",""
"Food Insecurity","ServiceRequest","ServiceRequest.code","SNOMED CT US","464041000124106","Referral to Child and Adult Care Food Program (procedure)","","","",""
"Food Insecurity","ServiceRequest","ServiceRequest.code","SNOMED CT US","464031000124101","Referral to food pantry program (procedure)","","","",""
"Food Insecurity","ServiceRequest","ServiceRequest.code","SNOMED CT US","464021000124104","Referral to care navigator (procedure)","","","",""
"Food Insecurity","ServiceRequest","ServiceRequest.code","SNOMED CT US","464011000124107","Referral to care manager (procedure)","","","",""
"Food Insecurity","ServiceRequest","ServiceRequest.code","SNOMED CT US","464001000124109","Referral to case manager (procedure)","","","",""
"Food Insecurity","ServiceRequest","ServiceRequest.code","SNOMED CT US","462491000124104","Referral to benefits enrollment assistance program (procedure)","","","",""
"Food Insecurity","ServiceRequest","ServiceRequest.code","SNOMED CT US","462481000124102","Referral to Community Action Agency program (procedure)","","","",""
"Food Insecurity","ServiceRequest","ServiceRequest.code","SNOMED CT US","445641000124105","Technical nutrition education (procedure)","","","",""
"Food Insecurity","ServiceRequest","ServiceRequest.code","SNOMED CT US","445301000124102","Content-related nutrition education (procedure)","","","",""
"Food Insecurity","ServiceRequest","ServiceRequest.code","SNOMED CT US","445291000124103","Nutrition-related skills education (procedure)","","","",""
"Food Insecurity","ServiceRequest","ServiceRequest.code","SNOMED CT US","441351000124101","Counseling about nutrition using rewards and contingency management strategy (procedure)","","","",""
"Food Insecurity","ServiceRequest","ServiceRequest.code","SNOMED CT US","441341000124103","Counseling about nutrition using relapse prevention strategy (procedure)","","","",""
"Food Insecurity","ServiceRequest","ServiceRequest.code","SNOMED CT US","464081000124100","Referral to home-delivered meals program (procedure)","","","",""
"Food Insecurity","ServiceRequest","ServiceRequest.code","SNOMED CT US","464691000124107","Counseling for barriers to achieving food security (procedure)","","","",""
"Food Insecurity","ServiceRequest","ServiceRequest.code","SNOMED CT US","467691000124103","Assistance with application for Special Supplemental Nutrition Program for Women, Infants and Children (procedure)","","","",""
"Food Insecurity","ServiceRequest","ServiceRequest.code","SNOMED CT US","467681000124101","Assistance with application for Summer Food Service Program (procedure)","","","",""
"Food Insecurity","ServiceRequest","ServiceRequest.code","SNOMED CT US","467671000124104","Evaluation of eligibility for Child and Adult Care Food Program (procedure)","","","",""
"Food Insecurity","ServiceRequest","ServiceRequest.code","SNOMED CT US","467661000124106","Evaluation of eligibility for Community Meal Program (procedure)","","","",""
"Food Insecurity","ServiceRequest","ServiceRequest.code","SNOMED CT US","464621000124105","Evaluation of eligibility for home-delivered meals program (procedure)","","","",""
"Food Insecurity","ServiceRequest","ServiceRequest.code","SNOMED CT US","464631000124108","Evaluation of eligibility for Meals on Wheels Program (procedure)","","","",""
"Food Insecurity","ServiceRequest","ServiceRequest.code","SNOMED CT US","464641000124103","Evaluation of eligibility for medically tailored meals program (procedure)","","","",""
"Food Insecurity","ServiceRequest","ServiceRequest.code","SNOMED CT US","464651000124101","Evaluation of eligibility for Senior Farmers' Market Nutrition Program (procedure)","","","",""
"Food Insecurity","ServiceRequest","ServiceRequest.code","SNOMED CT US","467711000124100","Assistance with application for Senior Farmers' Market Nutrition Program (procedure)","","","",""
"Food Insecurity","ServiceRequest","ServiceRequest.code","SNOMED CT US","464671000124106","Counseling for readiness to implement food insecurity care plan (procedure)","","","",""
"Food Insecurity","ServiceRequest","ServiceRequest.code","SNOMED CT US","464681000124109","Counseling for food insecurity care plan participation barriers (procedure)","","","",""
"Food Insecurity","ServiceRequest","ServiceRequest.code","SNOMED CT US","464721000124102","Provision of food prescription (procedure)","","","",""
"Food Insecurity","ServiceRequest","ServiceRequest.code","SNOMED CT US","467591000124102","Evaluation of eligibility for food pantry program (procedure)","","","",""
"Food Insecurity","ServiceRequest","ServiceRequest.code","SNOMED CT US","467601000124105","Evaluation of eligibility for Food Distribution Program on Indian Reservations (procedure)","","","",""
"Food Insecurity","ServiceRequest","ServiceRequest.code","SNOMED CT US","467611000124108","Evaluation of eligibility for Farmers' Market Nutrition Program for Women, Infants and Children (procedure)","","","",""
"Food Insecurity","ServiceRequest","ServiceRequest.code","SNOMED CT US","467621000124100","Evaluation of eligibility for Supplemental Nutrition Assistance Program (procedure)","","","",""
"Food Insecurity","ServiceRequest","ServiceRequest.code","SNOMED CT US","467631000124102","Evaluation of eligibility for Summer Food Service Program (procedure)","","","",""
"Food Insecurity","ServiceRequest","ServiceRequest.code","SNOMED CT US","467641000124107","Evaluation of eligibility for Gus Schumacher Nutrition Incentive funded program (procedure)","","","",""
"Food Insecurity","ServiceRequest","ServiceRequest.code","SNOMED CT US","467651000124109","Evaluation of eligibility for garden program (procedure)","","","",""
"Food Insecurity","ServiceRequest","ServiceRequest.code","SNOMED CT US","464241000124101","Education about food prescription program (procedure)","","","",""
"Food Insecurity","ServiceRequest","ServiceRequest.code","SNOMED CT US","464661000124104","Evaluation of eligibility for Special Supplemental Nutrition Program for Women, Infants and Children (procedure)","","","",""
"Food Insecurity","ServiceRequest","ServiceRequest.code","SNOMED CT US","710925007","Provision of food (procedure)","","","",""
"Food Insecurity","ServiceRequest","ServiceRequest.code","SNOMED CT US","464701000124107","Counseling for readiness to achieve food security goals (procedure)","","","",""
"Food Insecurity","ServiceRequest","ServiceRequest.code","SNOMED CT US","467721000124108","Assistance with application for Medically Tailored Meals Program (procedure)","","","",""
"Food Insecurity","ServiceRequest","ServiceRequest.code","SNOMED CT US","713109004","Referral to community meals service (procedure)","","","",""
"Food Insecurity","ServiceRequest","ServiceRequest.code","SNOMED CT US","711069006","Coordination of care plan (procedure)","","","",""
"Food Insecurity","ServiceRequest","ServiceRequest.code","SNOMED CT US","710824005","Assessment of health and social care needs (procedure)","","","",""
"Food Insecurity","ServiceRequest","ServiceRequest.code","SNOMED CT US","61310001","Nutrition education (procedure)","","","",""
"Food Insecurity","ServiceRequest","ServiceRequest.code","SNOMED CT US","467821000124101","Assistance with application for Supplemental Nutrition Assistance Program (procedure)","","","",""
"Food Insecurity","ServiceRequest","ServiceRequest.code","SNOMED CT US","467811000124109","Assistance with application for Farmers' Market Nutrition Program for Women, Infants and Children (procedure)","","","",""
"Food Insecurity","ServiceRequest","ServiceRequest.code","SNOMED CT US","467801000124106","Assistance with application for Community Meal Program (procedure)","","","",""
"Food Insecurity","ServiceRequest","ServiceRequest.code","SNOMED CT US","467791000124105","Assistance with application for Food Distribution Program on Indian Reservations (procedure)","","","",""
"Food Insecurity","ServiceRequest","ServiceRequest.code","SNOMED CT US","467781000124107","Assistance with application for Child and Adult Care Food Program (procedure)","","","",""
"Food Insecurity","ServiceRequest","ServiceRequest.code","SNOMED CT US","467741000124101","Assistance with Application for Gus Schumacher Nutrition Incentive Program (procedure)","","","",""
"Food Insecurity","ServiceRequest","ServiceRequest.code","SNOMED CT US","467771000124109","Assistance with application for food pantry program (procedure)","","","",""
"Food Insecurity","ServiceRequest","ServiceRequest.code","SNOMED CT US","467761000124102","Assistance with application for food prescription program (procedure)","","","",""
"Food Insecurity","ServiceRequest","ServiceRequest.code","SNOMED CT US","467751000124104","Assistance with application for garden program (procedure)","","","",""
"Food Insecurity","ServiceRequest","ServiceRequest.code","SNOMED CT US","467731000124106","Assistance with application for Home-Delivered Meals Program (procedure)","","","",""
"Homelessness","Condition","Condition.code","SNOMED CT US","32911000","Homeless (finding)","","","",""
"Homelessness","Condition","Condition.code.coding","ICD-10-CM","Z59.0","Homelessness","","","",""
"Homelessness","ObservationSR","Observation.code","LOINC","71802-3","Housing status","","","",""
"Homelessness","ObservationSR","Observation.code","LOINC","93025-5","Protocol for Responding to and Assessing Patients' Assets, Risks, and Experiences [PRAPARE]","","Yes","",""
"Homelessness","ObservationSR","Observation.code","LOINC","96777-8","Accountable health communities (AHC) health-related social needs screening (HRSN) tool","","Yes","",""
"Homelessness","ObservationSR","Observation.value","LOINC","LA30190-5","I do not have housing (staying with others, in a hotel, in a shelter, living outside on the street, on a beach, in a car, or in a park)","","","",""
"Homelessness","ObservationSR","Observation.value","LOINC","LA30122-8","I choose not to answer this question","","","",""
"Homelessness","ObservationSR","Observation.value","LOINC","LA31995-6","I do not have a steady place to live (I am temporarily staying with others, in a hotel, in a shelter, living outside on the street, on a beach, in a car, abandoned building, bus or train station, or in a park)","","","",""
"Homelessness","ObservationSR","Observation.value","LOINC","LA31994-9","I have a place to live today, but I am worried about losing it in the future","","","",""
"Homelessness","ObservationSR","Observation.value","LOINC","LA31993-1","I have a steady place to live","","","",""
"Homelessness","ObservationSR","Observation.value","LOINC","LA30189-7","I have housing","","","",""
"Homelessness","ServiceRequest","ServiceRequest.code","CPT","96160","Administration of patient-focused health risk assessment instrument (eg, health hazard appraisal) with scoring and documentation, per standardized instrument","","","",""
"Homelessness","ServiceRequest","ServiceRequest.code","CPT","96156","Health behavior assessment or re-assessment (ie, health-focused clinical interview, behavioral observations, clinical decision making)","","","",""
"Homelessness","ServiceRequest","ServiceRequest.code","CPT","96161","Administration of caregiver-focused health risk assessment instrument (eg, depression inventory) for the benefit of the patient, with scoring and documentation, per standardized instrument","","","",""
"Homelessness","ServiceRequest","ServiceRequest.code","SNOMED CT US","711069006","Coordination of care plan (procedure)","","","",""
"Homelessness","ServiceRequest","ServiceRequest.code","SNOMED CT US","464611000124102","Coordination of care team (procedure)","","","",""
"Homelessness","ServiceRequest","ServiceRequest.code","SNOMED CT US","462481000124102","Referral to Community Action Agency program (procedure)","","","",""
"Homelessness","ServiceRequest","ServiceRequest.code","SNOMED CT US","710824005","Assessment of health and social care needs (procedure)","","","",""
"Homelessness","ServiceRequest","ServiceRequest.code","SNOMED CT US","464161000124109","Referral to community resource network program (procedure)","","","",""
"Homelessness","ServiceRequest","ServiceRequest.code","SNOMED CT US","308440001","Referral to social worker (procedure)","","","",""
"Homelessness","ServiceRequest","ServiceRequest.code","SNOMED CT US","464311000124109","Education about Community Action Agency program (procedure)","","","",""
"Homelessness","ServiceRequest","ServiceRequest.code","SNOMED CT US","464291000124105","Education about community resource network program (procedure)","","","",""
"Homelessness","ServiceRequest","ServiceRequest.code","SNOMED CT US","464131000124100","Referral to community health worker (procedure)","","","",""
"Homelessness","ServiceRequest","ServiceRequest.code","SNOMED CT US","464021000124104","Referral to care navigator (procedure)","","","",""
"Homelessness","ServiceRequest","ServiceRequest.code","SNOMED CT US","464011000124107","Referral to care manager (procedure)","","","",""
"Homelessness","ServiceRequest","ServiceRequest.code","SNOMED CT US","464001000124109","Referral to case manager (procedure)","","","",""
"Homelessness","ServiceRequest","ServiceRequest.code","SNOMED CT US","464301000124106","Education about benefits enrollment assistance program (procedure)","","","",""
"Homelessness","ServiceRequest","ServiceRequest.code","SNOMED CT US","462491000124104","Referral to benefits enrollment assistance program (procedure)","","","",""
"Housing Instability","ObservationSR","Observation.code","LOINC","96777-8","Accountable health communities (AHC) health-related social needs screening (HRSN) tool","","Yes","",""
"Housing Instability","ObservationSR","Observation.code","LOINC","71802-3","Housing status","","","",""
"Housing Instability","ObservationSR","Observation.code","LOINC","93669-0","Are you homeless or worried that you might be in the future [WellRx]","","","",""
"Housing Instability","ObservationSR","Observation.code","LOINC","93033-9","Are you worried about losing your housing [PRAPARE]","","","",""
"Housing Instability","ObservationSR","Observation.code","LOINC","96447-8","WE CARE Survey [WE CARE] Caregiver","","Yes","",""
"Housing Instability","ObservationSR","Observation.code","LOINC","93025-5","Protocol for Responding to and Assessing Patients' Assets, Risks, and Experiences [PRAPARE]","","Yes","",""
"Housing Instability","ObservationSR","Observation.code","LOINC","93667-4","WellRx Questionnaire - revised","","Yes","",""
"Housing Instability","ObservationSR","Observation.code","LOINC","96441-1","At risk of becoming homeless Caregiver","","","",""
"Housing Instability","ObservationSR","Observation.value","LOINC","LA33-6","Yes","","","",""
"Housing Instability","ObservationSR","Observation.value","LOINC","LA32-8","No","","","",""
"Housing Instability","ObservationSR","Observation.value","LOINC","LA30122-8","I choose not to answer this question","","","",""
"Housing Instability","ObservationSR","Observation.value","LOINC","LA31993-1","I have a steady place to live","","","",""
"Housing Instability","ObservationSR","Observation.value","LOINC","LA31995-6","I do not have a steady place to live (I am temporarily staying with others, in a hotel, in a shelter, living outside on the street, on a beach, in a car, abandoned building, bus or train station, or in a park)","","","",""
"Housing Instability","ObservationSR","Observation.value","LOINC","LA31994-9","I have a place to live today, but I am worried about losing it in the future","","","",""
"Housing Instability","ServiceRequest","ServiceRequest.code","CPT","96160","Administration of patient-focused health risk assessment instrument (eg, health hazard appraisal) with scoring and documentation, per standardized instrument","","","",""
"Housing Instability","ServiceRequest","ServiceRequest.code","CPT","96161","Administration of caregiver-focused health risk assessment instrument (eg, depression inventory) for the benefit of the patient, with scoring and documentation, per standardized instrument","","","",""
"Housing Instability","ServiceRequest","ServiceRequest.code","CPT","96156","Health behavior assessment or re-assessment (ie, health-focused clinical interview, behavioral observations, clinical decision making)","","","",""
"Housing Instability","ServiceRequest","ServiceRequest.code","SNOMED CT US","464021000124104","Referral to care navigator (procedure)","","","",""
"Housing Instability","ServiceRequest","ServiceRequest.code","SNOMED CT US","711069006","Coordination of care plan (procedure)","","","",""
"Housing Instability","ServiceRequest","ServiceRequest.code","SNOMED CT US","710824005","Assessment of health and social care needs (procedure)","","","",""
"Housing Instability","ServiceRequest","ServiceRequest.code","SNOMED CT US","464611000124102","Coordination of care team (procedure)","","","",""
"Housing Instability","ServiceRequest","ServiceRequest.code","SNOMED CT US","464311000124109","Education about Community Action Agency program (procedure)","","","",""
"Housing Instability","ServiceRequest","ServiceRequest.code","SNOMED CT US","464301000124106","Education about benefits enrollment assistance program (procedure)","","","",""
"Housing Instability","ServiceRequest","ServiceRequest.code","SNOMED CT US","464291000124105","Education about community resource network program (procedure)","","","",""
"Housing Instability","ServiceRequest","ServiceRequest.code","SNOMED CT US","308440001","Referral to social worker (procedure)","","","",""
"Housing Instability","ServiceRequest","ServiceRequest.code","SNOMED CT US","464131000124100","Referral to community health worker (procedure)","","","",""
"Housing Instability","ServiceRequest","ServiceRequest.code","SNOMED CT US","464011000124107","Referral to care manager (procedure)","","","",""
"Housing Instability","ServiceRequest","ServiceRequest.code","SNOMED CT US","464001000124109","Referral to case manager (procedure)","","","",""
"Housing Instability","ServiceRequest","ServiceRequest.code","SNOMED CT US","462491000124104","Referral to benefits enrollment assistance program (procedure)","","","",""
"Housing Instability","ServiceRequest","ServiceRequest.code","SNOMED CT US","462481000124102","Referral to Community Action Agency program (procedure)","","","",""
"Housing Instability","ServiceRequest","ServiceRequest.code","SNOMED CT US","464161000124109","Referral to community resource network program (procedure)","","","",""
"Inadequate Housing","Condition","Condition.code","SNOMED CT US","105531004","Housing unsatisfactory (finding)","","","",""
"Inadequate Housing","Condition","Condition.code.coding","ICD-10-CM","Z59.1","Inadequate housing","","","",""
"Inadequate Housing","Goal","Goal.description","SNOMED CT US","161036002","Housing adequate (finding)","","","",""
"Inadequate Housing","Goal","Goal.description","SNOMED CT US","224250004","Satisfactory living conditions (finding)","","","",""
"Inadequate Housing","Goal","Goal.description","SNOMED CT US","185960001","Housing problem solved (finding)","","","",""
"Inadequate Housing","ObservationSR","Observation.code","LOINC","96778-6","Problems with place where you live","","","yes",""
"Inadequate Housing","ObservationSR","Observation.code","LOINC","96777-8","Accountable health communities (AHC) health-related social needs screening (HRSN) tool","","Yes","",""
"Inadequate Housing","ObservationSR","Observation.component.code","LOINC","96778-6","Problems with place where you live","","","yes",""
"Inadequate Housing","ObservationSR","Observation.component.value","LOINC","LA31998-0","Lack of heat","","","yes",""
"Inadequate Housing","ObservationSR","Observation.component.value","LOINC","LA32001-2","Water leaks","","","yes",""
"Inadequate Housing","ObservationSR","Observation.component.value","LOINC","LA31997-2","Lead paint or pipes","","","yes",""
"Inadequate Housing","ObservationSR","Observation.component.value","LOINC","LA32000-4","Smoke detectors missing or not working","","","yes",""
"Inadequate Housing","ObservationSR","Observation.component.value","LOINC","LA28580-1","Mold","","","yes",""
"Inadequate Housing","ObservationSR","Observation.component.value","LOINC","LA31999-8","Oven or stove not working","","","yes",""
"Inadequate Housing","ObservationSR","Observation.component.value","LOINC","LA31996-4","Pests, such as bugs, ants, or mice","","","yes",""
"Inadequate Housing","ObservationSR","Observation.component.value","LOINC","LA9-3","None of the above","","","yes",""
"Inadequate Housing","ServiceRequest","ServiceRequest.code","CPT","96160","Administration of patient-focused health risk assessment instrument (eg, health hazard appraisal) with scoring and documentation, per standardized instrument","","","",""
"Inadequate Housing","ServiceRequest","ServiceRequest.code","CPT","96156","Health behavior assessment or re-assessment (ie, health-focused clinical interview, behavioral observations, clinical decision making)","","","",""
"Inadequate Housing","ServiceRequest","ServiceRequest.code","CPT","96161","Administration of caregiver-focused health risk assessment instrument (eg, depression inventory) for the benefit of the patient, with scoring and documentation, per standardized instrument","","","",""
"Inadequate Housing","ServiceRequest","ServiceRequest.code","SNOMED CT US","464131000124100","Referral to community health worker (procedure)","","","",""
"Inadequate Housing","ServiceRequest","ServiceRequest.code","SNOMED CT US","464611000124102","Coordination of care team (procedure)","","","",""
"Inadequate Housing","ServiceRequest","ServiceRequest.code","SNOMED CT US","464311000124109","Education about Community Action Agency program (procedure)","","","",""
"Inadequate Housing","ServiceRequest","ServiceRequest.code","SNOMED CT US","464001000124109","Referral to case manager (procedure)","","","",""
"Inadequate Housing","ServiceRequest","ServiceRequest.code","SNOMED CT US","464301000124106","Education about benefits enrollment assistance program (procedure)","","","",""
"Inadequate Housing","ServiceRequest","ServiceRequest.code","SNOMED CT US","710824005","Assessment of health and social care needs (procedure)","","","",""
"Inadequate Housing","ServiceRequest","ServiceRequest.code","SNOMED CT US","464291000124105","Education about community resource network program (procedure)","","","",""
"Inadequate Housing","ServiceRequest","ServiceRequest.code","SNOMED CT US","464161000124109","Referral to community resource network program (procedure)","","","",""
"Inadequate Housing","ServiceRequest","ServiceRequest.code","SNOMED CT US","49919000","Home safety education (procedure)","","","",""
"Inadequate Housing","ServiceRequest","ServiceRequest.code","SNOMED CT US","711069006","Coordination of care plan (procedure)","","","",""
"Inadequate Housing","ServiceRequest","ServiceRequest.code","SNOMED CT US","462491000124104","Referral to benefits enrollment assistance program (procedure)","","","",""
"Inadequate Housing","ServiceRequest","ServiceRequest.code","SNOMED CT US","464011000124107","Referral to care manager (procedure)","","","",""
"Inadequate Housing","ServiceRequest","ServiceRequest.code","SNOMED CT US","308440001","Referral to social worker (procedure)","","","",""
"Inadequate Housing","ServiceRequest","ServiceRequest.code","SNOMED CT US","464021000124104","Referral to care navigator (procedure)","","","",""
"Inadequate Housing","ServiceRequest","ServiceRequest.code","SNOMED CT US","462481000124102","Referral to Community Action Agency program (procedure)","","","",""
"Material Hardship","Condition","Condition.code","SNOMED CT US","5521000175101","Unable to afford blood pressure monitor (finding)","","","",""
"Material Hardship","Condition","Condition.code","SNOMED CT US","715046004","Unable to obtain medication (finding)","","","",""
"Material Hardship","Condition","Condition.code","SNOMED CT US","454061000124102","Unable to afford medication (finding)","","","",""
"Material Hardship","Condition","Condition.code","SNOMED CT US","5311000175103","Unable to afford visit copayment (finding)","","","",""
"Material Hardship","Condition","Condition.code","SNOMED CT US","5371000175108","Unable to afford glucose monitoring device (finding)","","","",""
"Material Hardship","Condition","Condition.code","SNOMED CT US","5731000175109","Unable to afford weight scale (finding)","","","",""
"Material Hardship","Condition","Condition.code.coding","ICD-10-CM","Z91.120","Patient's intentional underdosing of medication regimen due to financial hardship","","","",""
"Material Hardship","Goal","Goal.description","SNOMED CT US","715045000","Able to obtain medication (finding)","","","",""
"Material Hardship","ObservationSR","Observation.code","LOINC","93667-4","WellRx Questionnaire - revised","","Yes","",""
"Material Hardship","ObservationSR","Observation.code","LOINC","67089-3","You don't have enough money to buy the things you or your kids need [PhenX]","","","",""
"Material Hardship","ObservationSR","Observation.code","LOINC","62942-8","PhenX - chronic stress protocol 181301","","Yes","",""
