"SDOH Category","Resource","Resource Element","Code System","Code","Description","Grouping","Definition","Is Panel Code","Is Multiselect"
"Inadequate Housing","Procedure","Procedure.code","CRISPeR","N/A","Assessment of income","Assessment","Determination of a value, conclusion, or inference by evaluating evidence","",""
"Food Insecurity","Procedure","Procedure.code","CRISPeR","N/A","Assessment of military or veteran status","Assessment","Determination of a value, conclusion, or inference by evaluating evidence","",""
"Inadequate Housing","Procedure","Procedure.code","CRISPeR","N/A","Assessment of military or veteran status","Assessment","Determination of a value, conclusion, or inference by evaluating evidence","",""
"Employment Status","Procedure","Procedure.code","Unknown","N/A","Assessment of patient barriers","Assessment","Determination of a value, conclusion, or inference by evaluating evidence","",""
"Employment Status","Procedure","Procedure.code","Unknown","N/A","Assessment of patient goals","Assessment","Determination of a value, conclusion, or inference by evaluating evidence","",""
"Employment Status","Procedure","Procedure.code","Unknown","N/A","Assessment of progress toward goals","Assessment","Determination of a value, conclusion, or inference by evaluating evidence","",""
"Inadequate Housing","Procedure","Procedure.code","Gravity","IS-7","Assessment of progress toward goals to achieve adequate housing","Assessment","Determination of a value, conclusion, or inference by evaluating evidence","",""
"Financial Insecurity","Procedure","Procedure.code","Gravity","IS-7","Assessment of progress toward goals to achieve financial security","Assessment","Determination of a value, conclusion, or inference by evaluating evidence","",""
"Material Hardship","Procedure","Procedure.code","Gravity","IS-7","Assessment of progress toward goals to achieve financial security","Assessment","Determination of a value, conclusion, or inference by evaluating evidence","",""
"Inadequate Housing","Procedure","Procedure.code","Gravity","IS-07","Assessment of progress toward goals to achieve housing security","Assessment","Determination of a value, conclusion, or inference by evaluating evidence","",""
"Transportation Insecurity","Procedure","Procedure.code","Gravity","IS-1","Assessment of progress toward goals to achieve transportation security","Assessment","Determination of a value, conclusion, or inference by evaluating evidence","",""
"Food Insecurity","Procedure","Procedure.code","CRISPeR","N/A","Assessment of race or ethnicity","Assessment","Determination of a value, conclusion, or inference by evaluating evidence","",""
"Inadequate Housing","Procedure","Procedure.code","CRISPeR","N/A","Assessment of race or ethnicity","Assessment","Determination of a value, conclusion, or inference by evaluating evidence","",""
"Transportation Insecurity","Procedure","Procedure.code","Gravity","IS-5","Assessment of social risk","Assessment","Determination of a value, conclusion, or inference by evaluating evidence","",""
"Inadequate Housing","Procedure","Procedure.code","Unknown","N/A","Assistance with application for a Benefit Enrollment Assistance Program","Assistance with application","To give support or aid to; help","",""
"Employment Status","Procedure","Procedure.code","Unknown","N/A","Assistance with application for Benefit Enrollment Assistance Programs","Assistance with application","To give support or aid to; help","",""
"Transportation Insecurity","Procedure","Procedure.code","Gravity","IS-70","Assistance with application for Bike-Share Program","Assistance with application","To give support or aid to; help","",""
"Transportation Insecurity","Procedure","Procedure.code","Gravity","IS-94","Assistance with application for Car Repair Program","Assistance with application","To give support or aid to; help","",""
"Transportation Insecurity","Procedure","Procedure.code","Gravity","IS-74","Assistance with application for Car-Share Program","Assistance with application","To give support or aid to; help","",""
"Employment Status","Procedure","Procedure.code","Unknown","N/A","Assistance with application for Cash Assistance Program for Immigrants (CAPI)","Assistance with application","To give support or aid to; help","",""
"Financial Insecurity","Procedure","Procedure.code","Gravity","IS-91","Assistance with application for Cash Assistance Program for Immigrants (CAPI)","Assistance with application","To give support or aid to; help","",""
"Employment Status","Procedure","Procedure.code","Unknown","N/A","Assistance with application for Child Care Assistance Program","Assistance with application","To give support or aid to; help","",""
"Financial Insecurity","Procedure","Procedure.code","Gravity","IS-86","Assistance with application for Child Care Assistance Program","Assistance with application","To give support or aid to; help","",""
"Financial Insecurity","Procedure","Procedure.code","Gravity","IS-93","Assistance with application for Children's Health Insurance Program (CHIP)","Assistance with application","To give support or aid to; help","",""
"Employment Status","Procedure","Procedure.code","Unknown","N/A","Assistance with application for community resource assistance","Assistance with application","To give support or aid to; help","",""
"Transportation Insecurity","Procedure","Procedure.code","Gravity","IS-90","Assistance with application for Donated Vehicle Program","Assistance with application","To give support or aid to; help","",""
"Financial Insecurity","Procedure","Procedure.code","Gravity","IS-83","Assistance with application for Earned Income Tax Credit & Tax Preparation Assistance","Assistance with application","To give support or aid to; help","",""
"Transportation Insecurity","Procedure","Procedure.code","Gravity","IS-40","Assistance with application for Elderly and Disabled Transportation Program","Assistance with application","To give support or aid to; help","",""
"Employment Status","Procedure","Procedure.code","Unknown","N/A","Assistance with application for Employment Legal Aid Program","Assistance with application","To give support or aid to; help","",""
"Financial Insecurity","Procedure","Procedure.code","Gravity","IS-77","Assistance with application for Employment Legal Aid Program","Assistance with application","To give support or aid to; help","",""
"Financial Insecurity","Procedure","Procedure.code","Gravity","IS-81","Assistance with application for Financial Counseling/Literacy","Assistance with application","To give support or aid to; help","",""
"Financial Insecurity","Procedure","Procedure.code","Gravity","IS-82","Assistance with application for Financial Loan Counseling Program","Assistance with application","To give support or aid to; help","",""
"Transportation Insecurity","Procedure","Procedure.code","Gravity","IS-35","Assistance with application for Gas Voucher programs","Assistance with application","To give support or aid to; help","",""
"Financial Insecurity","Procedure","Procedure.code","Gravity","IS-92","Assistance with application for General Relief Program","Assistance with application","To give support or aid to; help","",""
"Financial Insecurity","Procedure","Procedure.code","Gravity","IS-95","Assistance with application for Health Insurance Navigator","Assistance with application","To give support or aid to; help","",""
"Inadequate Housing","Procedure","Procedure.code","Gravity","IS-31","Assistance with application for Home improvement/repair loan and grant programs","Assistance with application","To give support or aid to; help","",""
"Inadequate Housing","Procedure","Procedure.code","Gravity","IS-43","Assistance with application for Home repair program","Assistance with application","To give support or aid to; help","",""
"Inadequate Housing","Procedure","Procedure.code","Gravity","IS-89","Assistance with application for Housing with Services program (no disability required for entry)","Assistance with application","To give support or aid to; help","",""
"Material Hardship","Procedure","Procedure.code","Gravity","IS-78","Assistance with application for Internet Assistance Program","Assistance with application","To give support or aid to; help","",""
"Employment Status","Procedure","Procedure.code","Unknown","N/A","Assistance with application for job development (training and employment programs)","Assistance with application","To give support or aid to; help","",""
"Financial Insecurity","Procedure","Procedure.code","Gravity","IS-75","Assistance with application for Job development (training and employment programs)","Assistance with application","To give support or aid to; help","",""
"Financial Insecurity","Procedure","Procedure.code","Gravity","IS-74","Assistance with application for Job Finding Assistance Program","Assistance with application","To give support or aid to; help","",""
"Employment Status","Procedure","Procedure.code","Unknown","N/A","Assistance with application for Job Finding Assistance Programs","Assistance with application","To give support or aid to; help","",""
"Inadequate Housing","Procedure","Procedure.code","Unknown","N/A","Assistance with application for legal aid","Assistance with application","To give support or aid to; help","",""
"Material Hardship","Procedure","Procedure.code","Gravity","IS-74","Assistance with application for Lifeline Wireless Program","Assistance with application","To give support or aid to; help","",""
"Transportation Insecurity","Procedure","Procedure.code","Gravity","IS-48","Assistance with application for Medicaid Transportation Program","Assistance with application","To give support or aid to; help","",""
"Inadequate Housing","Procedure","Procedure.code","Gravity","IS-94","Assistance with application for medical respite for homeless","Assistance with application","To give support or aid to; help","",""
"Transportation Insecurity","Procedure","Procedure.code","Gravity","IS-66","Assistance with application for Micro-Transit Program","Assistance with application","To give support or aid to; help","",""
"Financial Insecurity","Procedure","Procedure.code","Gravity","IS-78","Assistance with application for Microenterprise development/support","Assistance with application","To give support or aid to; help","",""
"Transportation Insecurity","Procedure","Procedure.code","Gravity","IS-44","Assistance with application for Para-transit Program","Assistance with application","To give support or aid to; help","",""
"Inadequate Housing","Procedure","Procedure.code","Gravity","IS-90","Assistance with application for Permanent Supportive Housing program (disability required for entry)","Assistance with application","To give support or aid to; help","",""
"Financial Insecurity","Procedure","Procedure.code","Gravity","IS-79","Assistance with application for Prescription Assistance Program","Assistance with application","To give support or aid to; help","",""
"Transportation Insecurity","Procedure","Procedure.code","Gravity","IS-52","Assistance with Application for Public Transportation Voucher Program","Assistance with application","To give support or aid to; help","",""
"Inadequate Housing","Procedure","Procedure.code","Gravity","IS-91","Assistance with application for Rapid Re-housing program","Assistance with application","To give support or aid to; help","",""
"Financial Insecurity","Procedure","Procedure.code","Gravity","IS-94","Assistance with application for Representative Payee Program","Assistance with application","To give support or aid to; help","",""
"Transportation Insecurity","Procedure","Procedure.code","Gravity","IS-62","Assistance with application for Ridesharing Program","Assistance with application","To give support or aid to; help","",""
"Inadequate Housing","Procedure","Procedure.code","Gravity","IS-92","Assistance with application for Safe Haven program","Assistance with application","To give support or aid to; help","",""
"Food Insecurity","Procedure","Procedure.code","Gravity","I-40","Assistance with application for school meal and snack program","Assistance with application","To give support or aid to; help","",""
"Financial Insecurity","Procedure","Procedure.code","Gravity","IS-90","Assistance with application for Special supplemental nutrition program for women, infants, and children (WIC) program","Assistance with application","To give support or aid to; help","",""
"Inadequate Housing","Procedure","Procedure.code","Gravity","IS-87","Assistance with application for subsidized housing","Assistance with application","To give support or aid to; help","",""
"Financial Insecurity","Procedure","Procedure.code","Gravity","IS-85","Assistance with application for Supplemental Nutrition Assistance Program (SNAP)","Assistance with application","To give support or aid to; help","",""
"Financial Insecurity","Procedure","Procedure.code","Gravity","IS-87","Assistance with application for Supplemental Security Income (SSI) Program","Assistance with application","To give support or aid to; help","",""
"Transportation Insecurity","Procedure","Procedure.code","Gravity","IS-57","Assistance with application for Taxi/Ride Hailing Voucher Program","Assistance with application","To give support or aid to; help","",""
"Material Hardship","Procedure","Procedure.code","Gravity","IS-82","Assistance with application for Telephone Assistance Program","Assistance with application","To give support or aid to; help","",""
"Financial Insecurity","Procedure","Procedure.code","Gravity","IS-80","Assistance with application for Temporary Financial Assistance","Assistance with application","To give support or aid to; help","",""
"Financial Insecurity","Procedure","Procedure.code","Gravity","IS-84","Assistance with application for Temporary Financial Assistance for Needy Families (TANF) Program","Assistance with application","To give support or aid to; help","",""
"Employment Status","Procedure","Procedure.code","Unknown","N/A","Assistance with application for the Veteran Assistance Benefits Program","Assistance with application","To give support or aid to; help","",""
"Employment Status","Procedure","Procedure.code","Unknown","N/A","Assistance with application for the Vocational Rehab Program","Assistance with application","To give support or aid to; help","",""
"Inadequate Housing","Procedure","Procedure.code","Gravity","IS-93","Assistance with application for Transitional Housing program","Assistance with application","To give support or aid to; help","",""
"Transportation Insecurity","Procedure","Procedure.code","Gravity","IS-78","Assistance with application for Transportation Network Companies (Ride Hailing) Program","Assistance with application","To give support or aid to; help","",""
"Financial Insecurity","Procedure","Procedure.code","Gravity","IS-88","Assistance with application for Unemployment Benefit Program","Assistance with application","To give support or aid to; help","",""
"Employment Status","Procedure","Procedure.code","Unknown","N/A","Assistance with application for unemployment benefits","Assistance with application","To give support or aid to; help","",""
"Financial Insecurity","Procedure","Procedure.code","Gravity","IS-89","Assistance with application for Veteran Assistance Benefits Program","Assistance with application","To give support or aid to; help","",""
"Financial Insecurity","Procedure","Procedure.code","Gravity","IS-76","Assistance with application for Vocational Rehab Program","Assistance with application","To give support or aid to; help","",""
"Transportation Insecurity","Procedure","Procedure.code","Gravity","IS-82","Assistance with application for Volunteer Driver Program","Assistance with application","To give support or aid to; help","",""
"Material Hardship","Procedure","Procedure.code","Gravity","IS-70","Assistance with application for weatherization program","Assistance with application","To give support or aid to; help","",""
"Inadequate Housing","Procedure","Procedure.code","Gravity","IS-35","Assistance with application for Weatherization programs","Assistance with application","To give support or aid to; help","",""
"Material Hardship","Procedure","Procedure.code","Gravity","IS-46","Assistance with application to Cash Assistance Program for Immigrants (CAPI)","Assistance with application","To give support or aid to; help","",""
"Material Hardship","Procedure","Procedure.code","Gravity","IS-42","Assistance with application to child care assistance program","Assistance with application","To give support or aid to; help","",""
"Material Hardship","Procedure","Procedure.code","Gravity","IS-58","Assistance with application to clothing assistance program","Assistance with application","To give support or aid to; help","",""
"Inadequate Housing","Procedure","Procedure.code","Gravity","IS-80","Assistance with application to Day Shelter program","Assistance with application","To give support or aid to; help","",""
"Material Hardship","Procedure","Procedure.code","Gravity","IS-38","Assistance with application to emergency financial assistance program","Assistance with application","To give support or aid to; help","",""
"Material Hardship","Procedure","Procedure.code","Gravity","IS-50","Assistance with application to General Relief Program","Assistance with application","To give support or aid to; help","",""
"Material Hardship","Procedure","Procedure.code","Gravity","IS-66","Assistance with application to Head Start","Assistance with application","To give support or aid to; help","",""
"Inadequate Housing","Procedure","Procedure.code","Gravity","IS-82","Assistance with application to Homelessness Prevention program","Assistance with application","To give support or aid to; help","",""
"Material Hardship","Procedure","Procedure.code","Gravity","IS-54","Assistance with application to Low Income Home Energy Assistance Program (LIHEAP)","Assistance with application","To give support or aid to; help","",""
"Material Hardship","Procedure","Procedure.code","Gravity","IS-33","Assistance with application to prescription assistance program","Assistance with application","To give support or aid to; help","",""
"Inadequate Housing","Procedure","Procedure.code","Gravity","IS-83","Assistance with application to rental assistance","Assistance with application","To give support or aid to; help","",""
"Material Hardship","Procedure","Procedure.code","Gravity","IS-62","Assistance with application to utility assistance program","Assistance with application","To give support or aid to; help","",""
"Employment Status","Procedure","Procedure.code","Unknown","N/A","Assistance with application to Cash Assistance Program for Immigrants (CAPI)","Assistance with application","To give support or aid to; help","",""
"Employment Status","Procedure","Procedure.code","Unknown","N/A","Coordination of care plan","Coordination","Process of organizing activities and sharing information to improve effectiveness","",""
"Employment Status","Procedure","Procedure.code","Unknown","N/A","Coordination of care team","Coordination","Process of organizing activities and sharing information to improve effectiveness","",""
"Employment Status","Procedure","Procedure.code","Unknown","N/A","Coordination of resources to address financial insecurity","Coordination","Process of organizing activities and sharing information to improve effectiveness","",""
"Inadequate Housing","Procedure","Procedure.code","Unknown","N/A","Coordination of resources to address housing inadequacy","Coordination","Process of organizing activities and sharing information to improve effectiveness","",""
"Inadequate Housing","Procedure","Procedure.code","Gravity","IS-25","Coordination of resources to address housing instability","Coordination","Process of organizing activities and sharing information to improve effectiveness","",""
"Transportation Insecurity","Procedure","Procedure.code","Gravity","IS-7","Coordination of resources to address transportation insecurity","Coordination","Process of organizing activities and sharing information to improve effectiveness","",""
"Employment Status","Procedure","Procedure.code","Unknown","N/A","Counseling about financial options","Counseling","Psychosocial procedure that involves listening, reflecting, etc to facilitate recognition of course of action/solution","",""
"Financial Insecurity","Procedure","Procedure.code","Gravity","IS-13","Counseling for barriers to achieving financial security","Counseling","Psychosocial procedure that involves listening, reflecting, etc to facilitate recognition of course of action/solution","",""
"Material Hardship","Procedure","Procedure.code","Gravity","IS-13","Counseling for barriers to achieving financial security","Counseling","Psychosocial procedure that involves listening, reflecting, etc to facilitate recognition of course of action/solution","",""
"Inadequate Housing","Procedure","Procedure.code","Unknown","N/A","Counseling for barriers to engagement","Counseling","Psychosocial procedure that involves listening, reflecting, etc to facilitate recognition of course of action/solution","",""
"Employment Status","Procedure","Procedure.code","Unknown","N/A","Counseling for barriers to engagement","Counseling","Psychosocial procedure that involves listening, reflecting, etc to facilitate recognition of course of action/solution","",""
"Inadequate Housing","Procedure","Procedure.code","Gravity","IS-12","Counseling for barriers to engagement in housing insecurity care plan","Counseling","Psychosocial procedure that involves listening, reflecting, etc to facilitate recognition of course of action/solution","",""
"Transportation Insecurity","Procedure","Procedure.code","Gravity","IS-9","Counseling for barriers to engagement in transportation insecurity care plan","Counseling","Psychosocial procedure that involves listening, reflecting, etc to facilitate recognition of course of action/solution","",""
"Inadequate Housing","Procedure","Procedure.code","Unknown","N/A","Counseling for barriers to goals","Counseling","Psychosocial procedure that involves listening, reflecting, etc to facilitate recognition of course of action/solution","",""
"Employment Status","Procedure","Procedure.code","Unknown","N/A","Counseling for barriers to goals","Counseling","Psychosocial procedure that involves listening, reflecting, etc to facilitate recognition of course of action/solution","",""
"Inadequate Housing","Procedure","Procedure.code","Gravity","IS-13","Counseling for barriers to goals to achieve housing security","Counseling","Psychosocial procedure that involves listening, reflecting, etc to facilitate recognition of course of action/solution","",""
"Transportation Insecurity","Procedure","Procedure.code","Gravity","IS-10","Counseling for barriers to goals to achieve transportation security","Counseling","Psychosocial procedure that involves listening, reflecting, etc to facilitate recognition of course of action/solution","",""
"Financial Insecurity","Procedure","Procedure.code","Gravity","IS-12","Counseling for financial security care plan barriers","Counseling","Psychosocial procedure that involves listening, reflecting, etc to facilitate recognition of course of action/solution","",""
"Material Hardship","Procedure","Procedure.code","Gravity","IS-12","Counseling for financial security care plan barriers","Counseling","Psychosocial procedure that involves listening, reflecting, etc to facilitate recognition of course of action/solution","",""
"Employment Status","Procedure","Procedure.code","Unknown","N/A","Counseling for readiness for engagement","Counseling","Psychosocial procedure that involves listening, reflecting, etc to facilitate recognition of course of action/solution","",""
"Inadequate Housing","Procedure","Procedure.code","Gravity","IS-15","Counseling for readiness for engagement in housing insecurity care plan","Counseling","Psychosocial procedure that involves listening, reflecting, etc to facilitate recognition of course of action/solution","",""
"Transportation Insecurity","Procedure","Procedure.code","Gravity","IS-11","Counseling for readiness for engagement in transportation insecurity care plan","Counseling","Psychosocial procedure that involves listening, reflecting, etc to facilitate recognition of course of action/solution","",""
"Employment Status","Procedure","Procedure.code","Unknown","N/A","Counseling for readiness for goals","Counseling","Psychosocial procedure that involves listening, reflecting, etc to facilitate recognition of course of action/solution","",""
"Transportation Insecurity","Procedure","Procedure.code","Gravity","IS-12","Counseling for readiness for goals to achieve transportation security","Counseling","Psychosocial procedure that involves listening, reflecting, etc to facilitate recognition of course of action/solution","",""
"Financial Insecurity","Procedure","Procedure.code","Gravity","IS-15","Counseling for readiness to achieve financial security goals","Counseling","Psychosocial procedure that involves listening, reflecting, etc to facilitate recognition of course of action/solution","",""
"Material Hardship","Procedure","Procedure.code","Gravity","IS-15","Counseling for readiness to achieve financial security goals","Counseling","Psychosocial procedure that involves listening, reflecting, etc to facilitate recognition of course of action/solution","",""
"Financial Insecurity","Procedure","Procedure.code","Gravity","IS-14","Counseling for readiness to implement financial security care plan","Counseling","Psychosocial procedure that involves listening, reflecting, etc to facilitate recognition of course of action/solution","",""
"Material Hardship","Procedure","Procedure.code","Gravity","IS-14","Counseling for readiness to implement financial security care plan","Counseling","Psychosocial procedure that involves listening, reflecting, etc to facilitate recognition of course of action/solution","",""
