"Action","Ledger ID","SDOH Code","SDOH Code Domain","SDOH Code Resource","SDOH Code Description","SDOH Code Type","Rating","Service","Organization","Timestamp"
"Updated","287","Z91.11","5","Condition","Patient's noncompliance with dietary regimen","ICD-10-CM","1","Simple Cooking with Heart","YMCA of Metropolitan Washington","2021-11-12 14:38:02"
"Updated","288","Z91.110","5","Condition","Patient’s noncompliance with dietary regimen due to financial hardship","ICD-10-CM","1","Simple Cooking with Heart","YMCA of Metropolitan Washington","2021-11-12 14:38:02"
"Updated","289","Z91.118","5","Condition","Patient’s noncompliance with dietary regimen due to other reason","ICD-10-CM","1","Simple Cooking with Heart","YMCA of Metropolitan Washington","2021-11-12 14:38:02"
"Updated","290","Z91.119","5","Condition","Patient’s noncompliance with dietary regimen due to unspecified reason","ICD-10-CM","1","Simple Cooking with Heart","YMCA of Metropolitan Washington","2021-11-12 14:38:02"
"Updated","291","1078229009","5","Goal","Food security (finding)","SNOMED CT US","1","Simple Cooking with Heart","YMCA of Metropolitan Washington","2021-11-12 14:38:03"
"Updated","292","G-8","5","Goal","Has adequate quality meals and snacks","Gravity","1","Simple Cooking with Heart","YMCA of Metropolitan Washington","2021-11-12 14:38:03"
"Updated","293","G-7","5","Goal","Has adequate number of meals and snacks daily","Gravity","1","Simple Cooking with Heart","YMCA of Metropolitan Washington","2021-11-12 14:38:03"
"Removed","294","","5","Procedure","Specified nutrition or medical counseling","Unknown","3","Simple Cooking with Heart","YMCA of Metropolitan Washington","2021-11-12 14:38:03"
"Updated","295","None","5","Procedure","Education","Gravity Grouping","3","Simple Cooking with Heart","YMCA of Metropolitan Washington","2021-11-12 14:43:13"
"Updated","296","445291000124103","5","Procedure","Nutrition-related skills education (procedure)","SNOMED CT US","3","Simple Cooking with Heart","YMCA of Metropolitan Washington","2021-11-12 14:43:13"
"Updated","297","464361000124107","5","Procedure","Education about Supplemental Nutrition Assistance Program (SNAP)","SNOMED CT US","3","Simple Cooking with Heart","YMCA of Metropolitan Washington","2021-11-12 14:43:13"
"Updated","298","I-25","5","Procedure","Content-related nutrition education","Gravity","3","Simple Cooking with Heart","YMCA of Metropolitan Washington","2021-11-12 14:43:13"
"Updated","299","61310001","5","Procedure","Nutrition education (procedure)","SNOMED CT US","3","Simple Cooking with Heart","YMCA of Metropolitan Washington","2021-11-12 14:43:13"
"Updated","300","None","5","Procedure","Assessment","Gravity Grouping","3","Home Delivered Meals","Food and Friends","2021-11-12 15:12:10"
"Updated","301","None","5","Procedure","Counseling","Gravity Grouping","3","Home Delivered Meals","Food and Friends","2021-11-12 15:12:10"
"Updated","302","None","5","Procedure","Education","Gravity Grouping","3","Home Delivered Meals","Food and Friends","2021-11-12 15:12:10"
"Updated","303","None","5","Procedure","Evaluation of eligibility","Gravity Grouping","3","Home Delivered Meals","Food and Friends","2021-11-12 15:12:10"
"Updated","304","None","5","Procedure","Provision","Gravity Grouping","3","Home Delivered Meals","Food and Friends","2021-11-12 15:12:10"
"Updated","305","None","5","Procedure","Referral","Gravity Grouping","3","Home Delivered Meals","Food and Friends","2021-11-12 15:12:10"
"Updated","306","Z59.43","5","Condition","Lack of safe drinking water or inadequate supply of drinking water","ICD-10-CM","1","Home Delivered Meals","Food and Friends","2021-11-12 15:12:10"
"Updated","307","Z59.423","5","Condition","Severe food insecurity (""The stage in the food insecurity spectrum best characterized by effects on food quantity"")","ICD-10-CM","2","Home Delivered Meals","Food and Friends","2021-11-12 15:12:10"
"Updated","308","Z59.422","5","Condition","Moderate food insecurity (""The stage in the food insecurity spectrum best characterized by effects on food quality and variety and safety"")","ICD-10-CM","2","Home Delivered Meals","Food and Friends","2021-11-12 15:12:10"
"Updated","309","Z91.1","5","Condition","Patient’s noncompliance with medical treatment and regimen","ICD-10-CM","1","Home Delivered Meals","Food and Friends","2021-11-12 15:12:10"
"Removed","310","","5","Condition","Lack of adequate food, inadequate food, or lack of food","ICD-10-CM","2","Home Delivered Meals","Food and Friends","2021-11-12 15:12:10"
"Updated","311","733423003","5","Condition","Food insecurity (finding)","SNOMED CT US","2","Home Delivered Meals","Food and Friends","2021-11-12 15:12:10"
"Updated","312","Z59.429","5","Condition","Food insecurity, unspecified and in need of referral","ICD-10-CM","2","Home Delivered Meals","Food and Friends","2021-11-12 15:12:10"
"Updated","313","Z59.421","5","Condition","Mild food insecurity (""The stage in the food insecurity spectrum best characterized by uncertainty and worry about adequate food resources and effects on cultural acceptability"")","ICD-10-CM","2","Home Delivered Meals","Food and Friends","2021-11-12 15:12:10"
"Updated","314","Z91.11","5","Condition","Patient's noncompliance with dietary regimen","ICD-10-CM","1","Home Delivered Meals","Food and Friends","2021-11-12 15:12:10"
"Updated","315","Z91.110","5","Condition","Patient’s noncompliance with dietary regimen due to financial hardship","ICD-10-CM","1","Home Delivered Meals","Food and Friends","2021-11-12 15:12:10"
"Updated","316","Z91.118","5","Condition","Patient’s noncompliance with dietary regimen due to other reason","ICD-10-CM","1","Home Delivered Meals","Food and Friends","2021-11-12 15:12:10"
"Updated","317","Z91.119","5","Condition","Patient’s noncompliance with dietary regimen due to unspecified reason","ICD-10-CM","1","Home Delivered Meals","Food and Friends","2021-11-12 15:12:10"
"Updated","318","1002224003","5","Procedure","Assessment for food insecurity (procedure)","SNOMED CT US","3","Home Delivered Meals","Food and Friends","2021-11-12 15:12:10"
"Updated","319","I-64","5","Procedure","Assessment of progress toward goals to achieve food security","Gravity","3","Home Delivered Meals","Food and Friends","2021-11-12 15:12:10"
"Updated","320","N/A","5","Procedure","Assessment of race or ethnicity","CRISPeR","3","Home Delivered Meals","Food and Friends","2021-11-12 15:12:10"
"Updated","321","N/A","5","Procedure","Assessment of military or veteran status","CRISPeR","3","Home Delivered Meals","Food and Friends","2021-11-12 15:12:10"
"Updated","322","N/A","5","Procedure","Assessment of gender","CRISPeR","3","Home Delivered Meals","Food and Friends","2021-11-12 15:12:10"
"Updated","323","N/A","5","Procedure","Assessment of familial role (caregivers, dependents, spouse, etc.)","CRISPeR","3","Home Delivered Meals","Food and Friends","2021-11-12 15:12:10"
"Updated","324","N/A","5","Procedure","Assessment of income","CRISPeR","3","Home Delivered Meals","Food and Friends","2021-11-12 15:12:10"
"Updated","325","1759002","5","Procedure","Assessment of nutritional status (procedure)","SNOMED CT US","3","Home Delivered Meals","Food and Friends","2021-11-12 15:12:10"
"Removed","326","","5","Procedure","Specified nutrition or medical counseling","Unknown","3","Home Delivered Meals","Food and Friends","2021-11-12 15:12:10"
"Updated","327","441041000124100","5","Procedure","Counseling about nutrition (procedure)","SNOMED CT US","3","Home Delivered Meals","Food and Friends","2021-11-12 15:12:10"
"Updated","328","464251000124105","5","Procedure","Education about congregate meal program (procedure)","SNOMED CT US","3","Home Delivered Meals","Food and Friends","2021-11-12 15:12:10"
"Updated","329","445291000124103","5","Procedure","Nutrition-related skills education (procedure)","SNOMED CT US","3","Home Delivered Meals","Food and Friends","2021-11-12 15:12:10"
"Updated","330","464231000124106","5","Procedure","Education about food pantry program (procedure)","SNOMED CT US","3","Home Delivered Meals","Food and Friends","2021-11-12 15:12:10"
"Updated","331","464341000124108","5","Procedure","Education about Senior Farmers' Market Nutrition Program (procedure)","SNOMED CT US","3","Home Delivered Meals","Food and Friends","2021-11-12 15:12:10"
"Updated","332","464361000124107","5","Procedure","Education about Supplemental Nutrition Assistance Program (SNAP)","SNOMED CT US","3","Home Delivered Meals","Food and Friends","2021-11-12 15:12:10"
"Updated","333","464281000124107","5","Procedure","Education about Special Supplemental Nutrition Program for Women, Infants and Children (WIC)","SNOMED CT US","3","Home Delivered Meals","Food and Friends","2021-11-12 15:12:10"
"Updated","334","464331000124103","5","Procedure","Education about Farmers' Market Nutrition Program for Women, Infants and Children (WIC)","SNOMED CT US","3","Home Delivered Meals","Food and Friends","2021-11-12 15:12:10"
"Updated","335","61310001","5","Procedure","Nutrition education (procedure)","SNOMED CT US","3","Home Delivered Meals","Food and Friends","2021-11-12 15:12:10"
"Updated","336","464641000124103","5","Procedure","Evaluation of eligibility for medically tailored meals program (procedure)","SNOMED CT US","3","Home Delivered Meals","Food and Friends","2021-11-12 15:12:10"
"Updated","337","464421000124107","5","Procedure","Provision of home-delivered meals (procedure)","SNOMED CT US","3","Home Delivered Meals","Food and Friends","2021-11-12 15:12:10"
"Updated","338","464431000124105","5","Procedure","Provision of medically tailored meals (procedure)","SNOMED CT US","3","Home Delivered Meals","Food and Friends","2021-11-12 15:12:10"
"Updated","339","710925007","5","Procedure","Provision of food (procedure)","SNOMED CT US","3","Home Delivered Meals","Food and Friends","2021-11-12 15:12:10"
"Updated","340","464021000124104","5","Procedure","Referral to care navigator (procedure)","SNOMED CT US","3","Home Delivered Meals","Food and Friends","2021-11-12 15:12:10"
"Updated","341","464011000124107","5","Procedure","Referral to care manager (procedure)","SNOMED CT US","3","Home Delivered Meals","Food and Friends","2021-11-12 15:12:10"
"Updated","342","462491000124104","5","Procedure","Referral to benefits enrollment assistance program (procedure)","SNOMED CT US","3","Home Delivered Meals","Food and Friends","2021-11-12 15:12:10"
"Updated","343","308440001","5","Procedure","Referral to social worker (procedure)","SNOMED CT US","3","Home Delivered Meals","Food and Friends","2021-11-12 15:12:10"
"Updated","344","464001000124109","5","Procedure","Referral to case manager (procedure)","SNOMED CT US","3","Home Delivered Meals","Food and Friends","2021-11-12 15:12:10"
"Updated","345","None","5","Procedure","Provision","Gravity Grouping","3","Commodity Supplemental Food Program","Capital Area Food Bank","2022-11-18 11:14:38"
"Updated","346","733423003","5","Condition","Food insecurity (finding)","SNOMED CT US","3","Commodity Supplemental Food Program","Capital Area Food Bank","2022-11-18 11:14:38"
"Updated","347","464421000124107","5","Procedure","Provision of home-delivered meals (procedure)","SNOMED CT US","3","Commodity Supplemental Food Program","Capital Area Food Bank","2022-11-18 11:14:38"
"Updated","348","710925007","5","Procedure","Provision of food (procedure)","SNOMED CT US","3","Commodity Supplemental Food Program","Capital Area Food Bank","2022-11-18 11:14:38"
"Added","349","105531004","3","Condition","Housing unsatisfactory (finding)","SNOMED CT US","2","Asthma Home Visits","Breathe DC","2023-03-28 20:48:20"
"Added","350","Z59.1","3","Condition","Inadequate housing","ICD-10-CM","2","Asthma Home Visits","Breathe DC","2023-03-28 20:48:20"
"Added","351","G-14","3","Goal","Housing meets inhabitants’ functional needs","Gravity","3","Asthma Home Visits","Breathe DC","2023-03-28 20:48:20"
"Added","352","G-11","3","Goal","Housing meets standards for internal environmental hazards","Gravity","3","Asthma Home Visits","Breathe DC","2023-03-28 20:48:20"
"Added","353","IS-7","3","Procedure","Assessment of progress toward goals to achieve adequate housing","Gravity","3","Asthma Home Visits","Breathe DC","2023-03-28 20:48:20"
"Added","354","N/A","3","Procedure","Assessment for housing inadequacy","Unknown","3","Asthma Home Visits","Breathe DC","2023-03-28 20:48:20"
"Added","355","711069006","3","Procedure","Coordination of care plan","SNOMED CT US","3","Asthma Home Visits","Breathe DC","2023-03-28 20:48:20"
"Added","356","","3","Procedure","Coordination of resources to address inadequate housing","Unknown","3","Asthma Home Visits","Breathe DC","2023-03-28 20:48:20"
"Added","357","N/A","3","Procedure","Provision of Asthma home visiting and remediation","Unknown","3","Asthma Home Visits","Breathe DC","2023-03-28 20:48:20"
"Added","358","None","5","Procedure","Provision","Gravity Grouping","3","Food Pantry Delivery","Bread for the City","2023-03-28 20:50:06"
"Added","359","","5","Condition","Lack of adequate food, inadequate food, or lack of food","ICD-10-CM","3","Food Pantry Delivery","Bread for the City","2023-03-28 20:50:06"
"Added","360","G-7","5","Goal","Has adequate number of meals and snacks daily","Gravity","3","Food Pantry Delivery","Bread for the City","2023-03-28 20:50:06"
"Added","361","710925007","5","Procedure","Provision of food (procedure)","SNOMED CT US","3","Food Pantry Delivery","Bread for the City","2023-03-28 20:50:06"
"Added","362","Z59.819","7","Condition","Housing instability, housed unspecified","ICD-10-CM","2","Housing","Calvary Women's Services","2023-03-28 20:57:36"
"Added","363","G-6","7","Goal","Access temporary housing","Gravity","3","Housing","Calvary Women's Services","2023-03-28 20:57:36"
"Added","364","G-1","7","Goal","Access permanent housing","Gravity","3","Housing","Calvary Women's Services","2023-03-28 20:57:36"
"Added","365","IS-25","7","Procedure","Coordination of resources to address housing instability","Gravity","3","Housing","Calvary Women's Services","2023-03-28 20:57:36"
"Added","366","IS-13","7","Procedure","Counseling for barriers to achieving housing stability","Gravity","3","Housing","Calvary Women's Services","2023-03-28 20:57:36"
"Added","367","IS-15","7","Procedure","Counseling for readiness for goals to achieve housing security","Gravity","3","Housing","Calvary Women's Services","2023-03-28 20:57:36"
"Added","368","IS-70","7","Procedure","Provision of housing support","Gravity","3","Housing","Calvary Women's Services","2023-03-28 20:57:36"
"Added","369","None","5","Procedure","Provision","Gravity Grouping","3","Direct Food Distribution Services","Capital Area Food Bank","2023-03-28 21:04:00"
"Added","370","","5","Condition","Lack of adequate food, inadequate food, or lack of food","ICD-10-CM","3","Direct Food Distribution Services","Capital Area Food Bank","2023-03-28 21:04:00"
"Added","371","706875005","5","Condition","Insufficient food supply (finding)","SNOMED CT US","3","Direct Food Distribution Services","Capital Area Food Bank","2023-03-28 21:04:01"
"Added","372","G-7","5","Goal","Has adequate number of meals and snacks daily","Gravity","3","Direct Food Distribution Services","Capital Area Food Bank","2023-03-28 21:04:01"
"Added","373","710925007","5","Procedure","Provision of food (procedure)","SNOMED CT US","3","Direct Food Distribution Services","Capital Area Food Bank","2023-03-28 21:04:01"
"Added","374","None","5","Procedure","Assessment","Gravity Grouping","3","Commodity Supplemental Food Program","Capital Area Food Bank","2023-03-28 21:06:34"
"Added","375","1002224003","5","Procedure","Assessment for food insecurity (procedure)","SNOMED CT US","3","Commodity Supplemental Food Program","Capital Area Food Bank","2023-03-28 21:06:34"
"Added","376","N/A","5","Procedure","Assessment of income","CRISPeR","3","Commodity Supplemental Food Program","Capital Area Food Bank","2023-03-28 21:06:34"
"Added","377","464401000124102","5","Procedure","Provision of fresh fruit and vegetable voucher (procedure)","SNOMED CT US","3","Commodity Supplemental Food Program","Capital Area Food Bank","2023-03-28 21:06:34"
"Added","378","None","5","Procedure","Assistance with application","Gravity Grouping","3","SHARE Food Network","Catholic Charities of the Archdiocese of Washington","2023-03-28 21:10:05"
"Added","379","None","5","Procedure","Provision","Gravity Grouping","3","SHARE Food Network","Catholic Charities of the Archdiocese of Washington","2023-03-28 21:10:05"
"Added","380","706875005","5","Condition","Insufficient food supply (finding)","SNOMED CT US","3","SHARE Food Network","Catholic Charities of the Archdiocese of Washington","2023-03-28 21:10:05"
"Added","381","Z59.421","5","Condition","Mild food insecurity (""The stage in the food insecurity spectrum best characterized by uncertainty and worry about adequate food resources and effects on cultural acceptability"")","ICD-10-CM","3","SHARE Food Network","Catholic Charities of the Archdiocese of Washington","2023-03-28 21:10:05"
"Added","382","G-7","5","Goal","Has adequate number of meals and snacks daily","Gravity","3","SHARE Food Network","Catholic Charities of the Archdiocese of Washington","2023-03-28 21:10:05"
"Added","383","IS-85","5","Procedure","Assistance with application for Supplemental Nutrition Assistance Program (SNAP)","Gravity","3","SHARE Food Network","Catholic Charities of the Archdiocese of Washington","2023-03-28 21:10:05"
"Added","384","1004110005","5","Procedure","Coordination of resources to address food insecurity (procedure)","SNOMED CT US","3","SHARE Food Network","Catholic Charities of the Archdiocese of Washington","2023-03-28 21:10:05"
"Added","385","710925007","5","Procedure","Provision of food (procedure)","SNOMED CT US","3","SHARE Food Network","Catholic Charities of the Archdiocese of Washington","2023-03-28 21:10:05"
"Added","386","D-5","7","Condition","Housing instability, housed at risk of eviction","Gravity","3","Tenant Advocacy","Central American Resource Center","2023-03-28 21:18:00"
"Added","387","D-1","7","Condition","Housing Instability related to economic circumstances","Gravity","3","Tenant Advocacy","Central American Resource Center","2023-03-28 21:18:00"
"Added","388","Z59.91","7","Condition","Worried about losing housing","ICD-10-CM","3","Tenant Advocacy","Central American Resource Center","2023-03-28 21:18:00"
"Added","389","D-12","7","Condition","Housing instability, housed","Gravity","3","Tenant Advocacy","Central American Resource Center","2023-03-28 21:18:00"
"Added","390","G-8","7","Goal","Stabilize housing","Gravity","3","Tenant Advocacy","Central American Resource Center","2023-03-28 21:18:00"
"Added","391","G-5","7","Goal","Access supportive services to maintain housing","Gravity","3","Tenant Advocacy","Central American Resource Center","2023-03-28 21:18:00"
"Added","392","IS-95","7","Procedure","Coordination of services to assist with maintaining housing security","Gravity","3","Tenant Advocacy","Central American Resource Center","2023-03-28 21:18:00"
"Added","393","IS-13","7","Procedure","Counseling for barriers to achieving housing stability","Gravity","3","Tenant Advocacy","Central American Resource Center","2023-03-28 21:18:00"
"Added","394","IS-85","7","Procedure","Education about Tenants right organization","Gravity","3","Tenant Advocacy","Central American Resource Center","2023-03-28 21:18:00"
"Added","395","IS-63","7","Procedure","Referral to tenants rights organization","Gravity","3","Tenant Advocacy","Central American Resource Center","2023-03-28 21:18:00"
"Added","396","IS-61","7","Procedure","Referral to additional service to maintain housing stability","Gravity","3","Tenant Advocacy","Central American Resource Center","2023-03-28 21:18:00"
"Added","397","None","7","Procedure","Provision","Gravity Grouping","3","Overnight Guests","Central Union Mission","2023-03-28 21:36:27"
"Added","398","None","7","Procedure","Referral","Gravity Grouping","3","Overnight Guests","Central Union Mission","2023-03-28 21:36:27"
"Added","399","Z59.0","7","Condition","Homelessness","ICD-10-CM","3","Overnight Guests","Central Union Mission","2023-03-28 21:36:27"
"Added","400","Z59.02","7","Condition","Unsheltered homelessness","ICD-10-CM","3","Overnight Guests","Central Union Mission","2023-03-28 21:36:27"
"Added","401","Z59.021","7","Condition","Residing in place not meant for human habitation such as: cars, parks, sidewalk, abandoned buildings","ICD-10-CM","3","Overnight Guests","Central Union Mission","2023-03-28 21:36:27"
"Added","402","G-7","7","Goal","Safe sleeping","Gravity","3","Overnight Guests","Central Union Mission","2023-03-28 21:36:27"
"Added","403","G-4","7","Goal","Access shelter","Gravity","3","Overnight Guests","Central Union Mission","2023-03-28 21:36:27"
"Added","404","IS-08","7","Procedure","Assessment of goals to achieve housing security","Gravity","3","Overnight Guests","Central Union Mission","2023-03-28 21:36:27"
"Added","405","710824005","7","Procedure","Assessment of health and social care needs (procedure)","SNOMED CT US","3","Overnight Guests","Central Union Mission","2023-03-28 21:36:27"
"Added","406","IS-101","7","Procedure","Referral to healthcare program for homeless","Gravity","3","Overnight Guests","Central Union Mission","2023-03-28 21:36:27"
"Added","407","308440001","7","Procedure","Referral to social worker (procedure)","SNOMED CT US","3","Overnight Guests","Central Union Mission","2023-03-28 21:36:27"
"Added","408","IS-73","7","Procedure","Referral to medical respite for homeless","Gravity","3","Overnight Guests","Central Union Mission","2023-03-28 21:36:27"
"Added","409","464021000124104","7","Procedure","Referral to care navigator (procedure)","SNOMED CT US","3","Overnight Guests","Central Union Mission","2023-03-28 21:36:27"
"Added","410","464001000124109","7","Procedure","Referral to case manager (procedure)","SNOMED CT US","3","Overnight Guests","Central Union Mission","2023-03-28 21:36:27"
"Added","411","","5","Condition","Lack of adequate food, inadequate food, or lack of food","ICD-10-CM","3","Food Assistance","Central Union Mission","2023-03-28 21:39:58"
"Added","412","733423003","5","Condition","Food insecurity (finding)","SNOMED CT US","3","Food Assistance","Central Union Mission","2023-03-28 21:39:58"
"Added","413","D-1","6","Condition","Material hardship","Gravity","3","Food Assistance","Central Union Mission","2023-03-28 21:39:58"
"Added","414","454061000124102","6","Condition","Unable to afford medication (finding)","SNOMED CT US","3","Food Assistance","Central Union Mission","2023-03-28 21:39:58"
"Added","415","IS-9","6","Procedure","Assessment of barriers in financial security care plan","Gravity","3","Food Assistance","Central Union Mission","2023-03-28 21:39:58"
"Added","416","Z59.00","7","Condition","Homelessness unspecified","ICD-10-CM","3","Homelessness and Housing","Community Connections, Inc.","2023-03-29 12:27:14"
"Added","417","Z59.0","7","Condition","Homelessness","ICD-10-CM","3","Homelessness and Housing","Community Connections, Inc.","2023-03-29 12:27:14"
"Added","418","Z59.022","7","Condition","Residing on the street","ICD-10-CM","3","Homelessness and Housing","Community Connections, Inc.","2023-03-29 12:27:14"
"Added","419","Z59.02","7","Condition","Unsheltered homelessness","ICD-10-CM","3","Homelessness and Housing","Community Connections, Inc.","2023-03-29 12:27:14"
"Added","420","Z59.021","7","Condition","Residing in place not meant for human habitation such as: cars, parks, sidewalk, abandoned buildings","ICD-10-CM","3","Homelessness and Housing","Community Connections, Inc.","2023-03-29 12:27:14"
"Added","421","G-7","7","Goal","Safe sleeping","Gravity","3","Homelessness and Housing","Community Connections, Inc.","2023-03-29 12:27:14"
"Added","422","G-6","7","Goal","Access temporary housing","Gravity","3","Homelessness and Housing","Community Connections, Inc.","2023-03-29 12:27:14"
"Added","423","G-3","7","Goal","Access housing resources","Gravity","3","Homelessness and Housing","Community Connections, Inc.","2023-03-29 12:27:14"
"Added","424","G-4","7","Goal","Access shelter","Gravity","3","Homelessness and Housing","Community Connections, Inc.","2023-03-29 12:27:14"
"Added","425","IS-17","7","Procedure","Health Risk Assessment","Gravity","3","Homelessness and Housing","Community Connections, Inc.","2023-03-29 12:27:14"
"Added","426","IS-93","7","Procedure","Assistance with application for Transitional Housing program","Gravity","3","Homelessness and Housing","Community Connections, Inc.","2023-03-29 12:27:14"
"Added","427","IS-89","7","Procedure","Assistance with application for Housing with Services program (no disability required for entry)","Gravity","3","Homelessness and Housing","Community Connections, Inc.","2023-03-29 12:27:14"
"Added","428","IS-90","7","Procedure","Assistance with application for Permanent Supportive Housing program (disability required for entry)","Gravity","3","Homelessness and Housing","Community Connections, Inc.","2023-03-29 12:27:14"
"Added","429","IS-81","7","Procedure","Assistance with application to Emergency Shelter program","Gravity","3","Homelessness and Housing","Community Connections, Inc.","2023-03-29 12:27:14"
"Added","430","IS-71","7","Procedure","Coordination of housing care plan","Gravity","3","Homelessness and Housing","Community Connections, Inc.","2023-03-29 12:27:14"
"Added","431","464611000124102","7","Procedure","Coordination of care team (procedure)","SNOMED CT US","3","Homelessness and Housing","Community Connections, Inc.","2023-03-29 12:27:14"
"Added","432","IS-14","7","Procedure","Counseling for readiness for engagement in housing insecurity care plan","Gravity","3","Homelessness and Housing","Community Connections, Inc.","2023-03-29 12:27:14"
"Added","433","IS-70","7","Procedure","Provision of housing support","Gravity","3","Homelessness and Housing","Community Connections, Inc.","2023-03-29 12:27:14"
