id,name,alternate_name,description,email,url,tax_status,tax_id,year_incorporated,legal_status
7239,"LIVE WELL THERAPY GROUP, LLC.",LWTG,"Live Well Therapy Group (LWTG) is a counseling practice with extensive experience working with children, adolescents, adults, families and couples. Some of the issues we work with are: depression, anxiety, ADD/ADHD, grief and loss, women's issues, substance abuse, domestic violence, victims of abuse (all types), adolescent issues, eating disorders, communication skills, social skills, bipolar, and adoption issues. Provides psychoeducational evaluations for children, surgery patients or for those undergoing fertility treatments.",,www.livewelltherapygroup.com,,,,
7240,"SAFE HAVEN RECOVERY, INC.",,"Safe Haven Recovery Center is a Private drug and alcohol treatment center.The goal is to provide treatment to our patients while teaching ways of sober living without the use of drugs and alcohol.\n\nSubstances Treated: \nAlcohol, prescription meds, methadone, heroin, cocaine, crystal meth, morphine, inhalants, molly (MDMA), ecstasy, PCP, and most other addictive drugs.\n\nTreatment Programs: \nInpatient Treatment,Detox, Intensive Outpatient Treatment, Outpatient Treatment and complete after care services to assist the patient in maintaining their sobriety.\n\nLiving Quarters: \nSeparate from the recovery facility to prevent patients from feeling institutionalized.",,http://safehavenrecovery.com,,,,
7242,"READING AND DYSLEXIA CENTER OF FLORIDA, LLC.",,"We are Reading Specialists/Interventionists knowledgeable in research based strategies proven to target and reduce symptoms of dyslexia. We provide individualized and specialized instruction designed to meet the specific reading needs of each child. Students go up 1 grade level in reading in 10-16 sessions. Program is online.\n\nServices: Early Reading Intervention, Reading Improvement/Acceleration, Evaluation/Assessment, Dyslexia/Dysgraphia, ADD/ADHD",,www.readingdyslexiafl.com,,,,
7259,YEAR UP MIAMI,,"Year Up is an award-winning national 501(c)3 organization striving to close the Opportunity Divide by providing enabling young adults to move in minimum wage to meaningful careers in just one year. young adults with the skills, experience and support that will empower them to reach their potential through professional careers and higher education. Through a one-year intensive training program, Year Up provides  young adults ages 18-24 with a unique combination of hands-on technical and professional skills, college credit, and corporate internships. \n\nWith an annual operating budget of $70 million, Year Up will serve over 2,100 students in 2014 nationwide, with sites in: Atlanta, Boston, Bay Area (San Francisco and Silicon Valley), New York, Providence, Puget Sound (Seattle), National Capital Region (Washington DC) and Chicago, with Year Up Professional Training Corps (PTC) sites located in Miami, Baltimore and Philadelphia.\n\nVoted one of the Best NonProfits to Work For in the country by the NonProfit Times, Year Up is a rewarding place to work. Our staff is passionate, supportive, mission-driven, and committed to positive change and continuous learning. We set high standards for both ourselves and our students, and live by a set of core values that reflect an unshakable belief in the talent and full potential of our young people.  The work we do is life-changing, and we know that our team is the greatest asset in achieving our mission.",,www.yearup.org,,,,
7365,COLLIER COUNTY HEAD START,,"Head Start is a high quality early childhood program that serves children who are four on or before September 1st and whose families meet income guidelines. The Head Start program offers high quality educational, nutritional, medical, dental, mental health, disability and other services through strong partnerships that promote success through school readiness and family strengthening. Services are offered to meet the special needs of children with disabilities. \n\nThe goal of the Head Start program is to prepare children for kindergarten. Staff work with parents as partners to help children progress and to help the family meet its goals.\n\n###COL###",,www.collierschools.com/headstart,,,,
7366,"AFTER SCHOOL PROGRAMS, INC.",,"After School Programs, Inc. offers after school and summer camp programs at various public schools throughout Miami-Dade, Broward, Collier, Orange, and Palm Beach County. Currently serves 40 schools in Broward and 2 in Miami Dade. \n\nThe after school and summer enrichment programs are designed to provide a wide range of academic, social, cultural, physical, and recreational activities. The activities include Homework Help, Tutoring, Literacy, Technology, Science and Math, Project Based Learning, Nutrition, Parent Activities, Fitness, Swimming, Field Trips and Cultural Arts. Nutritional snacks and Supper Food Program are provided for the students at our after school and summer programs. \n\nNOTE: May 4th registration to the public opens for grant funded schools. Registration for all but grant camps have already started. \n\n###COL###",,www.aspkids.com,,,,
7377,"Y G INSTITUTE, INC.",,The Y G Institute is dedicated to re-establishing the family and community bond who are affected directly or indirectly by the Judicial system.,,yginstitute.org,,,,
7390,"HELP A DIABETIC CHILD, INC.",HADC,Purchases blood glucose testing supplies and insulin for children and college students who are financially distressed.\n\n###COL###,,www.helpadiabeticchild.org,,,,
7392,"LITERACY COUNCIL GULF COAST, INC.",,"To assist adults and children in acquiring the literacy skills necessary to improve their quality of life. We offer classes throughout Lee, Hendry, and Collier. \n\n###COL###",,www.literacygulfcoast.com,,,,
7402,"UNITY ON THE BAY, INC.",,"Unity on the Bay is an inclusive community serving as a catalyst for spiritual awakening, evolution, and action. Programs to the community include classes and workshops on self-discovery and mastery. We also have services to support families in need through our Angels Everywhere yearly programs of: Backpack Drive, Food Drive, Christmas Drive and Toiletry Drive.",,http://www.unityonthebay.org/,,,,
7405,"MIAMI COUNSELING AND RESOURCE CENTER, INC.",MCRC,"We are a group practice located in Coral Gables. Our center provides individual, couples, and family counseling, as well as ADHD and gifted testing evaluations. In addition, we have two psychiatrists and a nutritionist on staff.",,www.miamicounseling.com,,,,
7443,"SUNLIGHT OF COLLIER COUNTY, INC.",SUNLIGHT HOME,"Sunlight Home is a God based maternity home offering a Safe Haven to women of all ages. Services provided include:\n\nMedical Services: \nNurses who work as trained peer counselors and have experience in meeting the needs of women facing the unique challenges of pregnancy.\n\nCounseling Services:\nProvides trained counselors to speak with in confidence.\n\nContinued Education and Parenting Classes:\nOffers free and informal classes for expectant and new moms. Classes also features fun guest speakers, informational videos, and lively group discussions.\n\nAdoption Information and Services:\nOffers adoption counseling and options to expectant mothers. \n\n###COL###",,http://sunlighthome.org/,,,,
7449,"FLORIDA BLUE, INC.",BLUE CROSS BLUE SHIELD OF FLORIDA,"Florida Blue provides: Health Insurance Education, Affordable healthcare solutions such as Life, Dental, Accident, Critical Illness, Hospital Indemnity insurance sales. Personal support for health and wellness, and community support through outreach and education in the communities we serve.",,www.floridablue.com,,,,
7457,"BRAIN CENTER, INC.",,"Brain Center is a non-profit organization working to help patients, families, and caregivers deal with the effects of chronic, degenerative neurological diseases like Alzheimer's Multiple Sclerosis, Parkinson's disease and Stroke. \n\nPrimary Services:\n\n* Social Work\n* Case Management\n* Individual and Family Counseling\n* Medication Management\n* Referrals and connections to community resources\n* Empowerment through educational and therapeutic programs",,www.braincenter.org,,,,
7459,"DELIVER THE DREAM, INC.",DTD,"Deliver the Dream provides structured, therapeutic, fun activities for families experiencing a serious illness or crisis on a three-day, two-night retreat weekend experience. Each retreat is geared towards a specific illness/crisis such as epilepsy, spina bifida, death of a loved one, down syndrome, multiple sclerosis, autism, cranial facial conditions, and cancer (breast cancer.)\n\nRetreat program is also available for combat veterans who are returning home along with their families.",,www.deliverthedream.org,,,,
7569,BLUE-FIELDS RESTORATION SERVICES,,"At Blue-Fields Restoration Counseling Services, the specialization is in Faith-based/Christian counseling, as well as traditional counseling. In order to encourage change, a variety of methods are offered: Individual, Marriage, Couples/Family and Mental Health counseling for the following issues:\n\n* Family Counseling\n* Youth Counseling \n* Life problem-solving \n* Depression\n* Addiction\n* Fear\n* Anger\n* Grief\n* Bereavement\n* Pregnancy\n* Post Divorce\n* Financial",,www.bluefields,,,,
7606,TWENTIETH JUDICIAL CIRCUIT COURT OF FLORIDA,,"The Twentieth Judicial Circuit, established in 1970, consists of Charlotte, Collier, Glades, Hendry and Lee Counties in Southwest Florida.\n\n###COL###",,http://www.ca.cjis20.org/home/main/homepage.asp,,,,
7617,"EVE'S HOPE, INC.",,"EveGÇÖs Hope is a place where a woman in an unplanned pregnancy can find free pregnancy testing, limited ultrasound, options counseling on parenting, adoption counseling, parenting classes, and an abortion recovery program (Forgiven and Set Free) for women who have experienced loss of life through abortion.",,www.EvesHope.Info,,,,
7642,CARE PATROL OF SOUTH FLORIDA IN MIAMI,CARE PATROL,"Care Patrol (Senior Care Finders) exists to provide care options for seniors across America. We help families find assisted living, independent living, memory care, and in-home care. We review the care and violation history of the communities we work with. We tour our clients to the recommended facilities. \n\nAssistance is provided by: Free senior care navigation.\n\n* Helping to navigate the confusing landscape of Senior Care.\n* Suggest payment assistance options.\n* Suggest other senior options which may be needed. \n* Narrow the possibilities and when possible, send electronic referrals to the client with virtual tours of recommended properties.\n\nBased on state admissions criteria as per the Agency for Healthcare Administration.",,www.carepatrol.com,,,,
7644,"ARCADIA ACADEMY, INC.",SUNFLOWERS ACADEMY,"Arcadia School, managed by Sunflowers Academy, is a program that provides quality after school care for children. We offer a variety of extracurricular activities, homework assistance, literacy classes, fitness and social skills building. Our goal is to provide children with a safe, caring environment that is influential to both learning and developing as well as provide recreational activities that are fun, stimulating and challenging.",,,,,,
7645,MIAMI-DADE COUNTY BOARD OF COMMISSIONERS,,"The Miami-Dade Board of County Commissioners is the governing body of unincorporated Miami-Dade County and has broad, regional powers to establish policies for Miami-Dade County services. The government provides major metropolitan services countywide and city-type services for residents of unincorporated areas.",,http://www.miamidade.gov/commission/home.asp,,,,
0,"MEDIWARE, LLC",,"Mediware develops and markets the world's most trusted, secure and comprehensive Web-based social services software, including its flagship solutions, ServicePoint and CommunityPoint. ServicePoint is the most widely used Consumer Information Management System (CIMS) and CommunityPoint is the social services portal of choice. When the challenges are how to connect, collaborate and cooperate, the answer is Mediware.",,https://www.mediware.com/,,,,
1,SWITCHBOARD 211,,"Switchboard 211 provides the Miami-Dade and Monroe County community with comprehensive telephone crisis counseling, suicide prevention, information and referral services 24 hours a day, 7 days a week, 365 days a year. Our agency also offers free individual and family counseling services and prevention programs for high-risk youth and their families based in local schools.",,https://jcsfl.org/services/switchboard-211/,,,,
17,"XCLUSIVE SENIOR DAY CARE CENTER, INC.",,"Xclusive Senior Day Care Center provides day care services for the elderly community. The program activities provide a mix of therapeutic programs, daily physical exercise, life enrichment programs (art, music and horticulture) and leisure activities (hobbies, crafts and outings). A hot noon meal (USDA Approved) along with morning and afternoon snacks is also provided. Transportation provided.\n\nProvides homemaker and companion services.",,www.xclusiveseniorcenter.com,,,,
21,TOWN OF CUTLER BAY PARKS AND RECREATION,,"The Parks and Recreation Department is part of the Town of Cutler Bay, a municipal corporation of the State of Florida.",,www.cutlerbay-fl.gov,,,,
23,"JUNIOR ACHIEVEMENT OF GREATER MIAMI, INC.",(JA),"Junior Achievement empowers young people to own their economic success. Their volunteer-based K-12 programs foster work-readiness, entrepreneurship, and financial literacy skills, and use experiential learning to inspire kids to dream big and reach their potential.\n\n###MON###",,www.jamiami.org,,,,
25,"SHERRY A. PALAMARA, PSYD, PA",,"Provides positive psychology, neuropsychology, neuropsychoeducation evaluations, employee assistance programs, cognitive behavioral and gesalt psychotherapy. Services provided to individuals, families, couples, children, adolescents and elderly with autism, aspergers, developmental delays, learning disabilities, medical conditions, mood disorders, anxiety and depression. Outpatient services provided to those who have addictions, are part of NA or AA, and referrals to detox centers can also be made. Assists with the LGBTQI community.",,,,,,
29,MIAMI-DADE OFFICE OF THE STATE ATTORNEY,,"Responsible for initiating charges and prosecuting individuals who have been accused of felony and misdemeanor offenses. Enforces child support orders and investigates allegations of major fraud, organized criminal activity, corruption and unlawful conduct by public officials.",,www.miamisao.com,,,,
38,U.S. CITIZENSHIP AND IMMIGRATION SERVICES,USCIS,U.S. Citizenship and Immigration Services (USCIS) is the government agency that oversees lawful immigration to the United States.\n\n###MON###\n###COL###,,www.uscis.gov,,,,
42,AL-ANON FAMILY GROUPS,ALATEEN; Alanon,Provides support for family and friends of people with a drinking problem. Alateen is for adolescents dealing with someone else's drinking.,,http://al-anon.alateen.org/,,,,
44,FLORIDA DEPARTMENT OF AGRICULTURE AND CONSUMER SERVICES,,"Under state law, most organizations which solicit contributions in Florida must register with the Florida Department of Agriculture and Consumer Services. Oversees the Division of Consumer Services and the Division of Agricultural Environmental Services and Division of Food Safety.\n\n###COL###\n###MON###",,www.freshfromflorida.com,,,,
51,"HABITAT FOR HUMANITY, INC.",,"A national Christian organization whose mission is to provide adequate, affordable homes to low income families.\n\n###COL###",,www.habitat.org,,,,
53,FLORIDA DEPARTMENT OF BUSINESS AND PROFESSIONAL REGULATION,,"Handles complaints regarding restaurants, hotels and food vendors including sanitation, food handling practices and fires. Licenses and regulates hundreds of professions including accountants, acupuncturists, a/c technicians, architects, asbestos removers, barbers, contractors, chiropractors, clinical social workers, cosmetologists, dentists, hygienists, engineers, funeral directors and embalmers, geologists, harbor pilots, hearing aid specialists, land surveyors, marriage & family therapists, opticians, optometrists, osteopaths, pharmacists, physical therapists, physicians, podiatrists, property appraisers, psychologists, real estate agents, respiratory therapists, talent agents, veterinarians, etc. Handles complaints on sewage overflow in duplexes and apartment buildings. \n\n\n###COL###\n###MON###",,www.myfloridalicense.com,,,,
55,"CHILDREN'S TUMOR FOUNDATION, INC.",,"The Children's Tumor Foundation is dedicated to improving the health and well-being of individuals and families affected by neurofibromatosis (NF), the term for three distinct disorders: NF1, NF2 and Schwannomatosis.\n\n###MON###\n###COL###",,www.ctf.org,,,,
57,CARLOS ALBIZU UNIVERSITY (MIAMI CAMPUS),Caribbean Center for Advanced Studies - Miami Institute of Psychology,"Private (non-profit) specialized university level institution offering a four-year Bachelor of Science Degree in Psychology; Bachelor of Arts in Elementary Education; Bachelor in Business Administration; Master of Science Degree in Psychology with Concentration in Mental Health Counseling, School Counseling, Marriage and Family Therapy; Specialized in new role and Child Care Psychology; Master of Science Degree in Industrial/Organizational Psychology; Master of Science in Exceptional Student Education; Doctor of Psychology Degree in Clinical Psychology with concentration in General Practice, Neuropsychology and Forensic Psychology.",,www.mia.albizu.edu,,,,
59,CITY OF MIAMI - NEIGHBORHOOD ENHANCEMENT TEAMS,NET,This program of the City of Miami Community Development Department provides information & referral and access to City of Miami services and operations. Operates the NET offices located at 11 sites around the city.,,http://www.miamigov.com/nets/,,,,
75,"HIALEAH HOUSING AUTHORITY, INC.",,"The Hialeah Housing Authority is dedicated to providing this community with quality, affordable housing that is decent and safe to eligible families. Assistance for  low income families is made possible through the Affordable Housing Program, Housing Choice Voucher (Section 8) Program, Palm Centre, and Public Housing Program.",,www.hialeahhousing.org,,,,
81,"CARE RESOURCE, INC.","COMMUNITY AIDS RESOURCE, INC.","Care Resource is one of the areas newest Federally Qualified Healthcare Centers serving clients in both Miami-Dade and Broward Counties. The agency provides easy, efficient access to a wide variety of quality health, prevention, education and psychosocial support services. Specific services offered include primary outpatient medical care, dental health care, case management, testing and counseling, women's programs, youth programs, food services, pharmacy and housing case management.",,www.careresource.org,,,,
100,"JESSIE TRICE COMMUNITY HEALTH CENTER, INC.",JTCHC,"The Jessie Trice Community Health Center, Inc. (JTCHC), is a Florida 501 (c) 3, not-for-profit, Federally Qualified Health Center, which has been serving Miami-Dade County since 1967. The target population is the uninsured,underinsured, 95% of which live at or below the Federal Poverty Level of 200%.",,www.jtchc.org,,,,
108,"INSTITUTE FOR CHILD AND FAMILY HEALTH, INC.","ICFH, Children's Psychiatric Center, Inc. (CPC)","Institute for Child and Family Health, Inc., provides a continuum of care to children, adolescents, and their families through a multidisciplinary team approach, that includes prevention and early intervention, outpatient and on-site mental health treatment, substance abuse prevention, case management, and educational services.  \n\nThe organization's goal is to provide high quality mental health,  prevention and psycho-educational services to children and their families.",,http://www.icfhinc.org/default.asp,,,,
134,"NATIONAL ASSOCIATION FOR THE ADVANCEMENT OF COLORED PEOPLE, INC.",NAACP,"The mission of the National Association for the Advancement of Colored People is to ensure the political, educational, social, and economic equality of rights of all persons and to eliminate race-based discrimination. \n\n###MON###\n###COL###",,www.naacp.org,,,,
318,MIAMI-DADE ECONOMIC ADVOCACY TRUST,MDEAP,Miami-Dade Economic Advocacy TrustGÇÖs mission is to ensure the equitable participation of Blacks in Miami-Dade County's economic growth through advocacy and monitoring of economic conditions and economic development initiatives in Miami-Dade County.,,www.miamidade.gov/mdeat,,,,
322,U.S. SOCIAL SECURITY ADMINISTRATION,United States Social Security Administration,"Provides monthly income for insured retired persons, for eligible survivors of deceased workers and for disabled workers who are not capable of gainful work. Local offices issue new or duplicate Social Security cards, enroll persons over 65 in Medicare and process applications. Most transactions can be handled by calling the 800 number.\n\n###MON###\n###COL###",,www.ssa.gov,,,,
331,HOMESTEAD POLICE DEPARTMENT,,"Responsible for enforcing all laws and ordinances of Homestead, preventing crime, investigating criminal activity, apprehending, arresting and detaining suspects, presenting evidence, regulating traffic and investigating accidents. Also provides a police athletic league and community building services.",,www.homesteadpolice.com,,,,
347,"COALITION OF FLORIDA FARMWORKER ORGANIZATIONS, INC.",COFFO,COFFO is a statewide organization whose main objective is to enhance the living and working conditions of migrant and seasonal farmworkers and the rural poor in Florida.,,www.coffo.org,,,,
359,CITY OF SOUTH MIAMI PARKS AND RECREATION DEPARTMENT,,"Administers South MiamiGÇÖs parks, open spaces, and recreation programs for many benefits, ranging from the pursuit of educational, cultural, health and fitness to out-of-school camps and programs, sports development, and special events. Dedicated to serving the community as a whole, the City of South Miami Parks and Recreation Department welcomes all people regardless of gender, age, ability or socio-economic status.",,http://www.southmiamifl.gov/Index.aspx?NID=149,,,,
362,SOUTH FLORIDA AIDS NETWORK,SFAN,"Established by Jackson Memorial Hospital in 1986, the South Florida AIDS Network (SFAN) was the first organization in Miami-Dade County to provide client advocacy/case management and related support services to people with HIV/AIDS. SFAN is now a large comprehensive HIV/AIDS service provider in Miami-Dade County.",,https://jacksonhealth.org/south-florida-aids-network-sfan/,,,,
367,"WOMEN AND TEENS HEALTHCARE, INC.",,"Women & Teens Healthcare provides services in the following:\n\nGynecology Services:\nPap smear, pelvic exam, screening, testing & treating STD's, surgical and medical abortion, morning after pill (plan B), birth control, intrauterine device (IUD), colposcopy, myomectomy, oophorectomy, reverse tubal ligation, salpingectomy, tubal ligation, laparoscopy, lower urinary tract infection, hysteroscopy, hysterectomy, endometrial biposy, cryosurgery, vryoablation, depo-provera      \n\nObstetrics:\n4D ultrasound, ultrasound, prenatal and postpartum care, general prenatal exams, preconception counseling, high-risk pregnancy care, genetic testing, pregnancy testing,  \n\nOffers counseling on all issues related to family planning, sexuality, women's health, relationships. Private counseling for sexual abuse and foster care children. Provides referrals to prenatal care and delivery sites in Miami-Dade & Broward County.",,www.womenandteens.com,,,,
373,"PLANNED PARENTHOOD OF SOUTH, EAST AND NORTH FLORIDA, INC.",,"Provides community education, peer education programs, teen clinic, and reproductive health services.",,http://www.plannedparenthood.org/ppsoflo/,,,,
385,"FAMILY RESOURCE CENTER OF SOUTH FLORIDA, INC.",,"The Center's mission is the prevention and treatment of child abuse and neglect through strengthening of families services including full case management, outpatient mental health counseling, parent education and adoption placement.",,www.frcflorida.org,,,,
387,"HOUSING DEVELOPMENT CORPORATION OF SW FLORIDA, INC.",HELP,"HDC, a.k.a. HELP is a HUD-certified 501(c)3 non-profit organization serving Southwest Florida. Services include very low, low and moderate income housing assistance to purchase a home, Fair Housing outreach and Homebuyer Education, HUD-certified credit and foreclosure counseling, and money management workshops. \n\n###COL###",,www.collierhousing.com,,,,
389,NATIONAL MULTIPLE SCLEROSIS SOCIETY,NMSS,"Provides counseling, community services, information and referral, and maintains a loan equipment closet for patients with no insurance or Medicare.",,http://www.nationalmssociety.org,,,,
391,MIAMI-DADE POLICE DEPARTMENT,M-DC POLICE DEPARTMENT,"Responsible for enforcing laws and ordinances, crime prevention, criminal investigations, apprehending, arresting and detaining suspects, presenting evidence, regulating traffic, and engaging in other activities that protect lives, property and peace in Miami-Dade County.",,http://www.miamidade.gov/Police/,,,,
417,MIAMI-DADE COUNTY REGULATORY AND ECONOMIC RESOURCES,"M-DC RER, Formerly CONSUMER SERVICES DEPARTMENT (CSD)","The Miami-Dade Regulatory and Economic Resources Department is charged with educating, informing and protecting consumers. We enforce consumer protection laws and business regulations, licenses certain businesses, and investigates and mediates consumer complaints. We also provide research and educational services targeted to agricultural producers, youth and families.",,www.miamidade.gov/business,,,,
424,"MACTOWN, INC.",,Provides a variety of services to developmentally disabled individuals and assist them to reach their performance potential in daily living and vocational skills.,,www.mactown.org,,,,
