id,name,alternate_name,description,email,url,tax_status,tax_id,year_incorporated,legal_status
6193,"SUMMER HOUSE DETOX CENTER, LLC.",,"Summer House provides in-patient substance abuse detox. Helps with alcohol detox, and detox from: Heroin, Methadone, Oxy-Contin, Suboxone, Benzodiazepine, Xanax, Valium, and Cocaine. \n\nOur mission is to make the detoxification process comfortable during their stay in a controlled environment until they are clean. Residents stay in a bed and breakfast style facility on the water and has an in house chef that provides 3 meals a day. \n\nSummer House works with other treatment centers and provides referrals that will further assist the client in their end goal.",,http://www.summerhousedetoxcenter.com/,,,,
6227,"THE AGRICULTURAL AND LABOR PROGRAM, INC.",ALPI,"ALPI administers a number of community services programs for migrant and seasonal farm workers and low-income families. The programs and services offered are diverse, in that services are provided to farm workers, low income individuals and their families, handicapped workers and youth. Some of the services provided are Emergency Services, Housing, Transportation, Vocational Training, GED, ESOL, Literacy and other support services. The department also serves as a clearinghouse for natural disasters that may affect farm workers.",,alpi.org,,,,
6229,"FLORIDA KEYS OUTREACH COALITION, INC.",FKOC for the Homeless,"The Florida Keys Outreach Coalition (FKOC for the Homeless) provides emergency shelter, transitional and permanent supportive housing for homeless individuals and families. FKOC provides homeless prevention services when funding permits. Prevention assistance includes rental assistance, utility assistance, transportation for work and medical appointments, assistance with medical and dental co-pays, assistance with required work supplies, and childcare assistance. An assessment process must be completed prior to any assistance being offered. Assistance is not guaranteed.",,www.FKOC.org,,,,
6233,HOUSING AUTHORITY OF THE CITY OF KEY WEST,,Provides housing to low and low-to-moderate income residents through Section 8 and public housing programs.\n\n###MON###,,http://www.kwha.org/wordpress0/,,,,
6236,"PRIDELINES YOUTH SERVICES, INC.",PRIDELINES,"To support, educate and empower South FloridaGÇÖs lesbian, gay, bisexual, transgender and questioning (LGBTQ) youth and community in safe and diverse spaces to promote dialogue, wellness and to foster social change.",,www.pridelines.org,,,,
6455,"BLIND SAILING UNLIMITED, INC.",,Blind Sailing Unlimited provides sailing opportunities for people who are blind and visually impaired. Introduction to sailing provides participants the opportunity to learn how to sail. \n\n\n###COL###,,www.blindsailingunlimited.org,,,,
6466,"JUVENILE DIABETES RESEARCH FOUNDATION, INC.",JDRF,JDRF specializes in diabetes research; it is the largest charitable funder of and advocates for type 1 diabetes research. The mission of JDRF is to find a cure for diabetes and its complications through the support of research. JDRF provides information and referrals for those diagnosed with type- 1 diabetes (t1d).\n\n\n###MON###\n###COL###,,jdrf.org,,,,
6477,"PACE CENTER FOR GIRLS, INC.",PACE,"PACE Center for Girls, Inc., is a Florida-based, not-for-profit, 501(c) 3 and the only state-wide prevention program for adolescent at-risk girls in the nation and is recognized as the most effective model in the country for reducing rates of detention and incarceration, teen pregnancy, substance abuse, dropping out of school, unemployment and long-term economic dependency amongst girls.\n\n###MON###\n###COL###",,http://www.pacecenter.org,,,,
6482,"MIAMI LEARNING EXPERIENCE SCHOOL, INC.",TLE,"Miami Learning Experience School (MLE) established in 1977 is a private non-profit school for children and adults with developmental disabilities. Promotes a safe and peaceful environment that encourages individualized academic, social and emotional growth for all children and adults with developmental disabilities. They provide students with the necessary tools to go beyond the classroom and become active members of the community.",,www.thelearningexperienceschool.org,,,,
6490,"SAMUEL'S HOUSE, INC.",,"Samuel's House provides housing to homeless women, women and men with children and intact families in Monroe County, FL. Services are provided in a compassionate environment while assisting individuals and families in developing the necessary tools and confidence to manage their own lives fully, responsibly and independently.  \n\nCase management services are provided to each client in all programs using evidence-based practices. There is zero tolerance for any act of violence or substance abuse and residents must all maintain their sobriety. It is a clean and sober house/shelter ONLY.\n\n###MON###",,www.samuelshouse.org,,,,
6508,"ANAGA PSYCHOTHERAPY CENTER, INC.",,"Provides a psychoeducational program that focuses on the treatment, education and prevention of substance abuse. Also offers a substance abuse treatment program which focuses on recovery from alcohol and drug abuse. Group counseling sessions focus on issues related to addiction, recovery, relapse prevention and ways to make positive lifestyle changes free from drug and alcohol. Both programs duration is a minimum of 16 weeks. \n\nAlso offers an anger control (Domestic Violence) program based on power and control issues designed to stop violence and educate the adolescent in issues of conflict management and anger control. The program is a minimum of 12 sessions including an initial assessment and group treatment. Parents are encouraged to participate in family therapy sessions. Adults S.A. training and Domestic Violence treatment for victims and offenders, Anger Management and parent education. Assessments for immigration clients are also available.\n\nIn addition, provides individual and couples counseling, parenting, mental health evaluations, educational evaluations, and play therapy.\n\nAssessments for immigration clients are also available.",,http://www.anagapsychotherapy.com,,,,
6517,"MASADA HOME CARE, INC.",,"Masada Home Care delivers quality, comprehensive services designed to meet the needs of older adults living in Miami-Dade. As a licensed home care agency, Masada provides home health aides and CNAs to help seniors remain in their own homes and living independently. Services include personal care, respite, homemaker assistance, companions, daily living support, transportation/escort services to assist clients in doctor's appointments and grocery shopping. In addition, Masada is able to submit insurance claims and bill third-party providers on behalf of clients served.",,http://masadacare.org/,,,,
6524,"NEEDYMEDS, INC.",,"NeedyMeds is a national non-profit information resource that helps people who are unable to afford medicine or health care costs find assistance programs at no cost to them. The website has information on pharmaceutical prescription assistance programs, medication coupons, programs that help people based on a diagnosis, free and low-cost clinics, government programs and other types of assistance programs.\n\n###COL###\n###MON###",,http://www.needymeds.org/index.htm,,,,
6526,"RHONDA REES VIVAS, PSY. D.",,"Clinical psychologist certified for eagala therapy (equestrian psychotherapy), cognitive processing therapy, cognitive behavioral therapy, and provides support groups in Auto Immune Disorders.",,,,,,
6529,"PETER WILLIG, LMFT",,"Peter Willig is a Licensed Marriage and Family Therapist that provides individual, family and group therapy as well as assessment and consultation services. Services include; treatment for issues of depression, thought and mood disorders, conduct disorders, anxiety, anorexia/bulimia, parenting skills training, marital and family, and bereavement counseling, specializing in child bereavement.\n\nClinical training and supervision provided.",,,,,,
6700,"FAMILYWIZE COMMUNITY SERVICE PARTNERSHIP, INC.",,"This program is a free resource for immediate savings on prescription medications. Savings average 45% on most FDA approved prescription medications. Simply present the card to your pharmacist when purchasing prescription medications and you will receive the lowest price available to you: the negotiated FamilyWize discounted rate, pharmacy price, or insurance price (if you have a health plan).  \n\nCan use the Drug Price LookUp Tool to know the cost of your prescription medications before you go to the pharmacy. It presents real time prices with the FamilyWize card and compares prices across pharmacies.   \n\nNo eligibility or registration is required.\n\n###MON###\n###COL###",,www.familywize.org,,,,
6714,"FLORIDA KEYS HEALTHY START COALITION, INC.",,"The Florida Keys Healthy Start Coalition is a 501(c)3 community based organization. We are a prenatal and infant care Coalition of private and public agencies, community-centered providers, local businesses and passionate individuals in Monroe County. It is the intent of the Healthy Start legislation to establish a system that guarantees that all women in Monroe County have access to prenatal care and that all infants have access to services that promote normal growth and development. Healthy Start services are provided free of charge and include but are not limited to: stress-management; home-visiting, parenting skills, nutritional information, baby-spacing information, breastfeeding and childbirth education, and assistance with accessing financial assistance for pregnancy costs and infant care costs. We work with women and families of all economic levels, with or without insurance.   \n\n###MON###",,www.keyshealthystart.org,,,,
6719,MONROE COUNTY PUBLIC SCHOOL DISTRICT,,Monroe County Public Schools is a public-governmental institution responsible for the public education of students residing in Monroe County from pre-kindergarten to adult education.\n\n###MON###,,https://fl02202360.schoolwires.net/,,,,
6883,"CANCER FOUNDATION OF THE FLORIDA KEYS, INC.",,"The Cancer Foundation of the Florida Keys offers assistance to qualified cancer patients living in the Florida Keys, and to aid them in their quest for education and treatment for their disease, in whatever way possible, whenever possible. Services provided include covering the costs of living expense assistance such as: phone bills, utility payment assistance, rent payment assistance, mortgage payment assistance, food vouchers, transportation, etc. \n\n**The foundation is a volunteer based organization with no physical office, client must call, leave a voicemail, and a representative will return their call.**\n\n###MON###",,www.keyscancer.org,,,,
6891,CITY OF MIAMI DEPARTMENT OF HOUSING AND COMMUNITY DEVELOPMENT,,"The Department of Community & Economic Development assists in creating a viable urban community for the most needy persons in our City while reducing poverty, embracing diversity, assisting with economic development, and improving the overall quality of life. It utilizes the grant funds it receives from federal and state government sources to carry out various community development activities that aide in providing decent housing, suitable living environments, improved community facilities and services, and the expansion of economic opportunities for the disadvantaged so as to assist those least likely to benefit from the economic growth projected for the City.",,www.miamigov.com/Government/Departments-Organizations/Housing-Community-Development,,,,
6894,THE BASILICA OF SAINT MARY STAR OF THE SEA,,Saint Mary Star of the Sea provides religious and various social services outreach programs to surrounding communities and Monroe County.\n\n###MON###,,keywestcatholicparish.org,,,,
6896,MONROE COUNTY EMERGENCY MANAGEMENT AND FIRE RESCUE,,"Monroe County Emergency Management provides planning and preparedness for, and coordination of, response activities for events that threaten the health and safety of Monroe County residents and visitors and that may damage property and affect the economy within the county.\n\n###MON###",,www.monroecountyem.com,,,,
6907,"SEASONS HOSPICE & PALLIATIVE CARE, INC.",,"Seasons Hospice & palliative care, offers home health aides, music therapy, spiritual support, bereavement support, and social workers. All patients will be under the care of a Registered Nurse case manager as part of their medical team. In addition, the Open Access Program can cover additional services such as IV antibiotics, IV hydration, oral chemotherapy, and other measures which will increase comfort of the patient at the end of his or her life. The Open Access Program is available on a case-by-case basis.",,www.seasons.org,,,,
6909,"DO THE RIGHT THING OF MIAMI, INC.",,"The purpose of Do The Right Thing of Miami, Inc. (DTRT) is to recognize and reward Miami youth for their exemplary behavior, accomplishments and good deeds through a unique partnership with the City of Miami Police Department and other participating law enforcement agencies in Miami Dade county. The DTRT Awards Program distinguishes exceptional school-age children who choose to be drug and crime free, exhibit non-violent behavior, do well in school, make a difference in their communities and demonstrate turnaround behavior.",,dotherightthinginc.org,,,,
6911,"SISTER SEASON FUND, INC.",,"The Sister Season Fund, Inc. is an effort by devoted Key West people to help locals employed in tourist related industries when a temporary financial emergency occurs through no fault of their own. There are times when those; especially in the service, entertainment and sales business; need some extra help to get over a 'bad time'. This non-profit has been formed to attempt to raise money for those tough times.\n\nThe fund assists with rent short falls and basic utility bills while recuperating from their illness or personal disaster, but will also attempt to help with uncovered medical expenses.",,www.sisterseason.com,,,,
6915,"KIDS COME FIRST IN THE FLORIDA KEYS, INC.",,The mission of Kids Come First is to provide school and personal supplies to every child experiencing financial adversity in Monroe County.\n\n###MON###,,,,,,
6917,"STEP UP FOR STUDENTS, INC.",,"Step Up For Students helps administer FOUR scholarship opportunities for Florida schoolchildren. \n\nFamilies eligible for the income-based Florida Tax Credit Scholarship Program have two scholarship options: one that helps cover private school tuition and fees or one that assists with transportation costs to attend a public school in another county. More than 1,800 schools statewide accept this scholarship.\n\nThe Gardiner Scholarship helps families customize education plans for their children with certain special needs and is available for qualified Florida students ages 3-22. The scholarship covers over 15 diagnoses, including autism spectrum disorder, Down syndrome, intellectual disability, spina bifida and traumatic brain injury. Parents can direct scholarship money toward a combination of approved programs and providers that best meet their childrenGÇÖs unique learning needs. These include approved private schools, therapists, specialists, curriculum and technology-even a college savings account.\n\nThe Hope Scholarship Program was created by the Florida Legislature in 2018 to provide the parent of a public school student who is bullied or a victim of violence an opportunity to transfer the student to another public school or to request a scholarship for the student to enroll in and attend an eligible private school. To qualify, the incident must have taken place at a public K-12 educational institution, any school-related or school-sponsored program or activity, or while riding on the school bus or waiting at the bus stop.\n\nThe Reading Scholarship Accounts is an education savings account program for third-through fifth-grade students enrolled in public schools who scored a 1 or 2 on the grade three or four English Language Arts section of the Florida Standards Assessment in the prior year. The program offers parents access to educational savings accounts, worth $500 each, to pay for tuition and fees related to part-time tutoring, summer and after-school literacy programs, instructional materials and more. Students who are classified as English Language Learners (ELL) and who are enrolled in a program or receiving services that are specifically designed to meet the instructional needs of English Language Learner students are also eligible and will receive priority. \n\n\n*Children who are in foster care, in out-of-home care or who are homeless also may be eligible for either of these FOUR scholarships. Visit www.StepUpForStudents.org/211 to learn more.",,www.StepUpForStudents.org,,,,
6920,"RURAL HEALTH NETWORK OF MONROE COUNTY FLORIDA, INC",RHNMC,"The Rural Health Network of Monroe County Florida, Inc. (RHNMC) is a non-profit organization formally recognized by the State of Florida to coordinate and integrate health care services for Monroe County residents. RHNMC was established in accordance with the Health Care Insurance Reform Act of 1993, which recognized that the efficient and effective delivery of quality health care services in rural areas requires the integration of private and public resources and the cooperative efforts of health care providers.\n\n###MON###",,www.rhnmc.org,,,,
6924,"MONROE ASSOCIATION FOR REMARCABLE CITIZENS, INC.",MARC,"MARC provides numerous services for our developmentally and intellectually disabled family members. These services are designed to insure our clients receive training and support that will enhance their individual abilities to learn social skills, self-care, understand daily community routines, medical and therapeutic supervision and increase the individual's ability to develop friendships with non-disabled persons. These services include residential long term care & training, supported living, adult day training, supported employment, community inclusion, transportation, medical and therapeutic supervision services, and respite care. \n\n###MON###",,www.marchouse.org,,,,
6926,"METROPOLITAN COMMUNITY CHURCH KEY WEST, INC.",MCC KEY WEST,"Metropolitan Community Church Key West is a member of The United Fellowship of Metropolitan Community Churches, a Christian Denomination teaching the message of God's inclusive love. Our mission is to witness GodGÇÖs inclusive and transforming love in the world.\n\n\n###MON###",,www.mcckeywest.com,,,,
6928,CITY OF KEY WEST,,"The City of Key West, in Monroe County, Florida, is at the tip of the Florida Keys.\n\n###MON###",,http://www.cityofkeywest-fl.gov/,,,,
6932,"COMMUNITY FOUNDATION OF THE FLORIDA KEYS, INC.",CFFK,The Community Foundation of the Florida Keys works to be a unique and vital partner to local charities by securing substantial sources of funds to strengthen the not-for-profit organizations whose services benefit the community at large.\n\n###MON###,,www.cffk.org,,,,
6936,"KEYS AREA INTERDENOMINATIONAL RESOURCES, INC.",KAIR,"KAIR is a non-profit organization seeking to serve those Middle Keys individuals and families in crisis. Services provided by KAIR include: \n\n* Food: Pre-made meals for the homeless and transients and bags of groceries are distributed for those are able to cook. Thanksgiving and Christmas Feast Baskets  \n* Medical and Dental: Assistance with prescriptions, co-pays to the clinic, and for medical appointments\n* Optical: Assistance with prescription glasses\n* Rent: Assistance to make a security deposit or a grant towards rent\n* Utilities: Water, electric, basic phone line \n* Transportation: Gas voucher, greyhound, local bus fare\n* ID Documents: Birth certificates, ID, work documents\n* School Supplies:Provides back-to-school backpacks, school supplies\n* ""Live Aboards"" Assistance: Provides sanitation devices and toilet hosing kits to maintain live aboard boats in Boot Key Harbor\n* Wish List Program: In-Kind donations of household goods, furniture, cars, clothing, baby items, etc., are delivered to KAIR on a daily basis and distributed to Keys residents for free.\n\n\n###MON###",,http://www.kaironline.net/index.html,,,,
6938,CENTER FOR INDEPENDENT LIVING OF THE KEYS,,"Our mission is to offer assistance to persons with disabilities in acquiring independent living, and self-advocacy skills in order to obtain and maintain independence and self-sufficiency. \n\nServices include: \n\nAssistance with benefit applications such as; Medicaid, Food Stamps, and Disability Income, an Educational Work Incentives Planning and Assistance programs that helps educate clients on the effect working through the vocational rehabilitation will have on their disability income and benefits, an Assisted Device Closet that provides wheelchairs, walkers, potty training chairs, etc., Assistance with social security issues, help with understanding Medicare (compare plans, advantage plans). Offers computer classes, arts and crafts, cooking class, benefits counseling, basic employment support (resume, job search), employment assistance referrals and general information and referrals. \n\n\n###MON###",,,,,,
6940,BAPTIST HEALTH - FISHERMEN'S COMMUNITY HOSPITAL,"FISHERMEN'S COMMUNITY HOSPITAL, INC.","FishermenGÇÖs Hospital is a non-profit community healthcare facility. We strive to continually improve the health status of our community, by providing high quality, cost effective health care, education and wellness services. Community well-being is our overriding goal and we strive to find new ways to keep the residents of our community healthy. We recognize the value of every person and are guided by our commitment to excellence.\n\nServices provided include:\n* Emergency Services\n* Diagnostic Imaging \n* Surgical Services\n* Laboratory\n* Respiratory/Cardiology \n* Physical Therapy\n* Pharmacy\n* Infection Control\n* Dietary Services\n\n\n\n###MON###",,https://baptisthealth.net/en/facilities/fishermens-community-hospital/pages/default.aspx,,,,
6944,"GOOD HEALTH CLINIC, INC.",,"The Good Health Clinic offers free primary care and other outpatient services, including regular check-ups in our clinic office, and referrals to specialists in Miami-Dade and Monroe Counties. \n\nServices provided include:\n\n* Primary care medical services\n* Wellness/Preventative Care\n* Walk-in/Urgent Care\n* Chronic Disease Management\n* WomenGÇÖs health\n* Referred Specialty Care\n* Care Coordination\n* Prescription Assistant\n* Diagnostic labs and imaging\n* Advanced medical care\n\n###MON###",,http://www.thegoodhealthclinic.org/,,,,
7048,WIEN CENTER FOR ALZHEIMER'S DISEASE AND MEMORY DISORDERS,,"The Wien Center for AlzheimerGÇÖs Disease and Memory Disorders at Mount Sinai Medical Center offers screening programs; early diagnosis; delaying progression by treating memory, cognitive problems and behavioral disturbances at an early stage; supporting and providing education to the caregivers and the public; and in conducting cutting-edge research. \n\nThe Wien CenterGÇÖs multidisciplinary approach incorporates neurology, psychiatry, geriatrics, diagnostic imaging, counseling, social support and referral to appropriate community resources to develop successful and effective treatment options for AlzheimerGÇÖs disease and other forms of dementia and memory disorders.",,www.msmc.com/neurosciences/wien-center-for-alzheimers-disease-memory-disorders,,,,
7060,BAL HARBOUR POLICE DEPARTMENT,,"The Bal Harbour Police department is dedicated to serving and protecting the residents and visitors of Bal Harbour Village, Florida.",,http://www.balharbourfl.gov/police,,,,
7070,CAREERSOURCE SOUTHWEST FLORIDA,,"Provide assistance for job seekers to find employment, link with employers, update skills through training, OJT opportunities or internships. Provide workshops in resume writing, interview skills, job search job applications, provides job matching for employers to find qualified candidates, post positions, host recruitment fairs etc. Also, Veteran Outreach for all veterans including disabled veterans.\n\n###COL###",,www.Careersourcesouthwestflorida.com,,,,
7081,FLORIDA DEPARTMENT OF CORRECTIONS,FLORIDA DOC,"The Florida Department of Corrections (DC) is the third largest state prison system in the country with a budget of $2.4 billion, just over 100,000 inmates incarcerated and another 115,000 offenders on active community supervision. \n\nThe DC has 143 facilities statewide, including 48 major institutions, 15 annexes, seven private facilities (contracts for the private facilities are overseen by the Florida Department of Management Services), 33 work camps, six road prisons and forestry camps, one boot camp, 20 DOC operated work release centers along with 13 more work release centers operated by various private vendors (DOC oversees these contracts). About three quarters of its staff of more than 25,000 employees are either certified correctional officers or probation officers. The average DC employee is 41 years old and has been with the agency for almost nine years. There were no prison escapes from a major prison last fiscal year.\n\n###MON###\n###COL###",,dc.state.fl.us,,,,
7088,"NAPLES COMMUNITY IMMIGRATION SERVICES, INC.",,"Naples Community Immigration Services, provides a variety of services to help people who have lived in the USA the requisite period of time apply to become a US citizens. Included may be photographs requirements for citizenship application, copies of the application for Naturalization form (N-400), assistance in completing the form, copies of questions typically asked by the Bureau of Citizenship and Immigration Services (CIS) in citizenship interviews and an opportunity to practice for the interview.\n\n###COL###",,,,,,
