id,name,alternate_name,description,email,url,tax_status,tax_id,year_incorporated,legal_status
136,"GIRL SCOUTS COUNCIL OF TROPICAL FLORIDA, INC.",,"The Girl Scout Council of Tropical Florida, Inc. is the preeminent local organization dedicated solely to all girls. Where, in an accepting and nurturing environment,girls build courage, confidence, and character. In partnership with committed adult volunteers, girls develop qualities that will serve them all their lives, such as, leadership, strong values, social conscience, and conviction about their own potential and self-worth.\n\n###MON###",,www.girlscoutsfl.org,,,,
143,OFFICE OF THE ATTORNEY GENERAL,,"The Office of the Attorney General, through the Division of Victim Services and Criminal Justice Programs, administers the Crimes Compensation Trust Fund. The division is comprised of the Bureau of Victim Compensation, the Bureau of Criminal Justice Programs, and the Bureau of Advocacy and Grants Management. Working in concert, the division seeks to meet the needs of crime victims by providing financial assistance through the victims compensation program; specialized direct services programs throughout the state. Additionally, the division is responsible for the allocation of the VOCA assistance grants to public and not for profit agencies and is responsible for the Address Confidentiality Program.\n\n\n###MON###\n###COL###",,www.myfloridalegal.com,,,,
145,MIAMI-DADE COUNTY BUILDING AND NEIGHBORHOOD COMPLIANCE DEPARTMENT,M-DC BUILDING AND NEIGHBORHOOD COMPLIANCE DEPARTMENT,"Building and Neighborhood Compliance is committed to maintaining neighborhoods and improving the quality of life in our community. We provide residential and commercial code compliance services in unincorporated Miami-Dade County. \n\nWe emphasize community education and voluntary compliance while seeking solutions for citizen concerns. Our main objective is to address violations such as overgrown lots, junk and trash, abandoned vehicles, graffiti, illegal signs in the right-of-way, zoning violations and other neighborhood maintenance regulations; in order to enhance life safety and aesthetics in our community.",,http://www.miamidade.gov/building/neighborhood-compliance.asp,,,,
147,"UNITED WAY OF MIAMI-DADE, INC.",,"United Way brings us together as a community to focus on the human care issues that matter most. It is a powerful partnership that improves people's lives and strengthens our community.  \n\nIn Miami Dade, we have a plan to achieve measurable outcomes in the areas of helping kids and families lead successful lives, improve health and independence, responding to emergency and basic needs, and encouraging neighborhood and civic involvement.",,unitedwaymiami.org,,,,
149,SALVATION ARMY,,"The Salvation Army has been serving Miami-Dade since 1913 through shelters, rehabilitation centers, emergency food, rental assistance, emergency disaster services, Christmas assistance, daily community outreach programs and more. \n\nThe Salvation Army provides 280 beds across three lodges to individuals recovering from a number of personal crises. Temporary shelter is intended to empower people to regain their independence and self-sufficiency. Our guests receive housing, meals, case management, life skills instruction and counseling in a clean, safe and supportive environment.\n\nTemporary housing under The Salvation ArmyGÇÖs Red Shield is designated for single women, single mothers with children, intact families, single men, single fathers with children, men and women veterans, those with HIV/AIDS and those needing recuperative care from medical incidents.\n\nAdditional services include tutoring, support groups, spiritual support and ad-hoc community services for employment and housing opportunities.",,www.salvationarmymiami.com,,,,
164,MIAMI-DADE GOVERNMENT INFORMATION CENTER,,"The Government Information Center provides access to government services through our web portal miamidade.gov and the 3-1-1 Answer Center, the Miami-Dade's multi-jurisdictional call center for non-emergency government services.",,http://www.miamidade.gov/information/311.asp,,,,
166,"SABER COLLEGE, INC.",,"Provides on the job training and employability skills training. Provides an ESOL program (5 levels), Physical Therapy Program PTA",,http://www.sabercollege.edu/,,,,
170,"REDLANDS CHRISTIAN MIGRANT ASSOCIATION - MIAMI, INC.",RCMA,"The Redlands Christian Migrant Association provides quality child care and early education for children of migrant farm workers and rural, low-income families throughout Florida. The largest non-profit child-care provider in Florida, RCMA is a leader in high-quality early childhood services. More than half of RCMA's child-care centers are nationally accredited.\n\n\n###COL###",,www.rcma.org,,,,
181,"UNITED HOMECARE, INC.","UHCS, United HomeCare Services, Inc.","Provides personalized quality care and in-home services to assist adults over 60, disabled adults 18-59, and their caregivers to live at home independently.",,www.unitedhomecare.com,,,,
190,MIAMI SHORES RECREATION DEPARTMENT,,"The Recreation Department strives to provide the residents of Miami Shores Village with the best in leisure programs and recreational facilities. The Department is comprised of several divisions: Administration, Aquatic Center, Athletics, Community Center, Tennis Center and Special Events. Programs are designed to provide an uplifting experience for the participants and/or spectators.",,http://www.miamishoresvillage.com/village-department/recreation,,,,
192,CITY OF MIAMI - POLICE DEPARTMENT,,"Responsible for enforcing laws and ordinances of the City of Miami, preventing crime, investigating criminal activity, apprehending, arresting and detaining suspects, presenting evidence, regulating traffic, and investigating traffic accidents. Also sponsors the Police Explorers and an athletic program for youth. The Victim Advocate Service for victims of crime.",,www.miami-police.org,,,,
206,JACKSON COMMUNITY MENTAL HEALTH CENTER,,"Jackson Community Mental Health Center (Jackson North CMHC) is a community-based, multi-service that provides comprehensive behavioral healthcare services for co-occurring adults and children with severe persistent mental illness and substance abuse problems. These services are provided for residents in the north and northwestern sections of Miami-Dade County. \n\nThe Center specializes in the provision of:\n \n* Adult Mental Health and Substance Abuse Services\n* Adult Case Management\n* Psychosocial Rehabilitation Services \n* Children's Mental Health and Substance Abuse Services\n* Children's Case Management Services\n* Individual and Group Therapy \n* Crisis Stabilization and Detoxification Services\n* Anger and Stress Management \n* Adult and Child Medication Management\n* Temporary Assistance for Needy Families (TANF)",,www.jhsmiami.org,,,,
216,VITAS HEALTHCARE CORPORATION,,"VITAS is headquartered in Miami, Florida, and operates 49 hospice programs in 16 states and the District of Columbia. VITAS employs 11,773 professionals who care for terminally ill patients daily-primarily in the patientsGÇÖ homes, but also in the companyGÇÖs 34 inpatient hospice units as well as in hospitals, nursing homes and assisted living communities/residential care facilities. VITAS team members include registered nurses, licensed practical nurses, home health aides, physicians, social workers, chaplains and other caregiving professionals.\n\n\n###MON###",,www.vitas.com,,,,
221,"FLORIDA LAWYERS ASSISTANCE, INC.",,"Florida Lawyers Assistance, Inc. is a non-profit corporation formed in 1986 in response to the Florida Supreme CourtGÇÖs mandate that a program be created to identify and offer assistance to bar members who suffer from substance abuse, mental health, or other disorders which negatively affect their lives and careers.\n\nJudges, attorneys, law students, and support personnel who seek the assistance of FLA need not worry that FLA will report them to the Bar, the Board of Bar Examiners, or their employer. Information is shared with these entities only if the participating individual signs a waiver of confidentiality.  \n\n\n###COL### \n###MON###",,www.fla-lap.org,,,,
225,"GUARDIANSHIP PROGRAM OF DADE COUNTY, INC.",,"Provides legal guardianship to adults 18 years of age and older who have been adjudicated legally incapacitated by the probate court, who have no relatives or friends willing or able to act as legal guardian and the legally incapacitated person is indigent. Assists with the health and welfare of legally incapacitated persons by using community resources to assure that their basic needs are met. Also acts as a monitor and an advocate to ensure that each ward receives benefits he/she is entitled to.",,www.guardianshipprogram.org,,,,
227,"CAMILLUS HEALTH CONCERN, INC.",CAMILLUS HEALTH,"Camillus Health Concern's services include adult primary care, pediatric services, women's preventive health services, HIV/AIDS/STD/TB prevention, screening and treatment, mental health services, oral health services and case management. Referral to Camillus House programs-CHC's sister organization, such as the Camillus Life Center (intensive outpatient substance abuse treatment); Camillus Housing Services; Camillus Emergency Services, ensures that patients have access to a comprehensive continuum of care services.\n\nTo facilitate access to care, Transportation Services includes van transportation, taxi, and tokens for the bus and metro rail.",,www.camillushealth.org,,,,
235,U.S. SMALL BUSINESS ADMINISTRATION,SBA,"The SBA promotes the interests of small businesses by providing technical and financial assistance. Information package available to anyone interested in starting a business. While SBA does not make loans directly, you can find a local lender who can help you with your loan application.\n\nBrevard, Broward, Charlotte, Collier, Desoto, Glades, Hardee, Hendry, Highlands, Hillsborough, Indian River, Lee, Manatee, Martin, Miami-Dade, Monroe, Okeechobee, Osceola, Palm Beach, Pasco, Pinellas, Polk, Saint Lucie, Sarasota.\n\n\n###MON###\n###COL###",,http://www.sba.gov/about-offices-content/2/3109,,,,
237,"MIAMI RESCUE MISSION, INC.",,"Provides refuge, food, comfort, care and spiritual guidance to homeless men, women, and children in two separate structures. Facilities include a 214-bed Men's Center and a 40-bed Women and Children's Center. The women shelter also offers overnight accommodations. The residential programs offer counseling, education and job referral services to help re-establish clients as productive citizens.",,www.miamirescuemission.org,,,,
246,"LUTHERAN SERVICES FLORIDA, INC.",LSF,"Lutheran Services Florida (LSF) is a statewide, non-profit, human services agency dedicated to helping all people in need regardless of religious affiliation, age or national origin. The agency has more than 60 programs located throughout Florida. \n\nServices provided include: the Child Care Food Program, PEPPI Head Start Child Development Center, Foster and Adoptions Case Management, Youth Shelters and Family Crisis Counseling Programs, Guardianship Program, Housing, Employment, Refugee and Immigration Programs, Ryan White AIDS Program, and Disaster Response Programs for victims of tornadoes, hurricanes, floods and other natural disasters. GÇï\n\n\n###MON###\n###COL###",,www.lsfnet.org,,,,
292,AMERICAN LUNG ASSOCIATION IN FLORIDA,,"The American Lung Association of the Southeast serves Florida, Georgia, and South Carolina with critical programs and services designed to reach everyone affected by lung disease.",,www.lungfla.org,,,,
294,"LUPUS FOUNDATION OF FLORIDA, INC.",,"Provides public awareness, support groups, information, meetings, referrals to medical providers, educational seminars, outreach coordination, and patient education for lupus patients. Books and pamphlets available. Research and studies information available. Publishes a quarterly and monthly newsletter. Members also belong to the National Foundation.\n\n\n###COL###\n###MON###",,www.lupusflorida.org/,,,,
296,CORAL GABLES POLICE DEPARTMENT,,The City of Coral Gables Police Department is responsible for enforcing all laws and ensuring public safety in the City of Coral Gables.,,https://www.coralgables.com/departments/Police,,,,
303,"FLORIDA INTERNATIONAL UNIVERSITY, INC.",FIU,"Florida International University is a student-centered public research university, offering bachelor's, master's, and doctoral degrees.",,www.fiu.edu,,,,
312,"IMPROVING LIVES COMMUNITY MENTAL HEALTH CENTER, INC.",,"Provides individual therapy (children, adolescent and adult), family counseling, couples communications, substance abuse counseling and DUI groups. Also provides an intensive out patient program.",,www.improvinglivesnow.com,,,,
314,AMERICAN ASSOCIATION OF RETIRED PERSONS,AARP,"AARP is a national, membership organization that advocates for individuals age 50 and older. Members need not be retired. Provides information on aging issues, educational material and courses, conducts research and offers a variety of volunteer opportunities and community services. They also sponsor the ""Alive 55"" driver's education classes for older drivers and the Tax Aid program to assist with income tax preparation.\n\n\n###MON###\n###COL###",,www.aarp.org,,,,
480,EPILEPSY FLORIDA,EFL,"Epilepsy  Florida (EFL) Epilepsy Florida is dedicated to supporting those impacted by epilepsy by confronting the spectrum of challenges created by seizures. EFL was established in 1971 as a not-for-profit 501(c)(3). EFL is the principal agency for epilepsy programs and services sponsored by the State of Florida, servicing the estimated 400,000 Floridians who suffer from the condition. It is a partner of the Epilepsy Alliance America. EFL serves as the lead advocate for the rights and needs of people with epilepsy and seizures at the local, county, state and national level.\n\nDirect services include: case management, medical services to clients, individual and family counseling, neuro-psychological testing and evaluations, support groups,epilepsy education to the community at large and Affordable Care Act Healthcare Navigation.",,www.epilepsyfl.org,,,,
485,"DOUGLAS GARDENS COMMUNITY MENTAL HEALTH CENTER, INC.",DOUGLAS GARDENS CMHC,The Douglas Gardens Community Mental Health Center provides comprehensive mental health services to people living in the Greater Miami Beach area.,,www.dgcmhc.org/,,,,
499,"DIABETES RESEARCH INSTITUTE FOUNDATION, INC.",,"Dedicated to improving the quality of life for the millions of people living with Diabetes, and providing information about current research and treatment.",,www.DiabetesResearch.org,,,,
501,"UNIDAD OF MIAMI BEACH, INC.",Miami Beach Hispanic Community Center,"Unidad of Miami Beach, Inc. is a non-profit agency that provides a wide range of social services, including employment assistance to the job-seeking public, a refugee program, elderly services, nutrition education, oral health services, a veterans program and much more, in the spirit of preserving and promoting the vibrant ethnic, racial, religious and cultural diversity of the Miami Beach community.",,http://www.unidadmb.org/,,,,
503,MIAMI-DADE COUNTY OFFICE OF COMMUNITY ADVOCACY,"OCAd, M-DC OFFICE OF COMMUNITY ADVOCACY","The Office of Community Advocacy (OCAd) is charged with making Miami-Dade County ""One Community"" that embraces our diverse enriched and unique population.",,http://www.miamidade.gov/advocacy/,,,,
509,"CROHN'S AND COLITIS FOUNDATION OF AMERICA, INC.",CCFA,"CCFA is dedicated to finding a cure for Crohn's disease and ulcerative colitis and to improving the quality of life for those afflicted with these illnesses. Maintains a coordinated national program of research and education, and helps patients and their families by offering mutual support programs.",,www.ccfa.org,,,,
513,UNIVERSITY OF MIAMI - DEPARTMENT OF PEDIATRICS,UM,"The Department of Pediatrics at the University of Miami School of Medicine is nationally and internationally acclaimed for education, research, patient care, and biomedical innovation.\n\nYoung patients come to UM from all over the world to receive quality care delivered with compassion by outstanding pediatric specialists and other skilled medical professionals. As part of the University of Miami School of Medicine, the Department of Pediatrics is integrated into a dynamic research environment where innovative and effective treatments and cures are under development.",,www.pediatrics.med.miami.edu,,,,
528,"THE ARTHRITIS FOUNDATION, INC.",,"The Arthritis Foundation's mission is to improve lives through leadership in the prevention, control and cure of arthritis and related diseases.\n\n###MON###\n###COL###",,www.arthritis.org,,,,
530,"CONCEPT HEALTH SYSTEMS, INC.",,Concept House is a not for profit social service agency licensed by the State of Florida Department of Children and Families. Serves the residents of Miami-Dade County in need of substance abuse treatment.,,www.concepthouse.org/,,,,
533,"NAMI OF MIAMI, INC.",NAMI,"This volunteer organization advocates for treatment and services for the recovery of mentally ill persons, advocates for legislative initiatives, provides comfort and support to affected families and disseminates information in the community.",,www.namiofmiami.org,,,,
541,THE BARNYARD,"COCONUT GROVE CARES, INC.",Coconut Grove Cares is a not for profit organization dedicated to building a better community for the children and families in the Village West Coconut Grove.,,www.coconutgrovecares.org,,,,
545,"ABUNDANT LIVING CITI CHURCH, INC.",,"Agency Programs and Services: Since our establishment in 2004, CitiChurch has worked through collaborations and partnerships to implement and institute services and programs that effectively serve the needs of children and families in our surrounding community.  \n\nCitiChurch currently has a partnership with The Children's Trust for a Out-of-School (CitiKidz After School, Spring Break and Summer Camp Program) and a Youth Prevention ""Higher Ground"" Culinary Arts Program. CitiChurch is also a State Approved SES Tutoring Provider, rated ""Excellent.""\n  \nCommunity Outreaches:  \nCitiChurch began local outreach in our community in 2004, sponsoring annual events such as: Hurricane Outreaches, Kidz Club, an outreach to children, Free Community Carnivals, Free Health Fairs in collaboration with various local agencies, Free Family Movie Nights, Family Fun Days, Holiday Outreaches and Celebrations, and Back to School Outreaches providing school supplies. Each outreach is targeted to reach families and children and create a safe and supportive community.",,www.citichurchmiami.com,,,,
547,"COMMUNITIES IN SCHOOLS OF MIAMI, INC.",CIS,Communities in Schools is dedicated to creating public/private partnerships for the benefit of Miami-Dade County Public Schools and community centers. Services offered include a mentorship program which is targeted to youth who are at-risk of dropping out of school.,,www.cismiami.org,,,,
560,"CHILDREN'S HOME SOCIETY OF FLORIDA, INC.",,"When kids are hurting, we help them heal. When kids need a safe place to call ""home,"" we find them loving families. When parents want to provide stable, nurturing homes for their babies, we help. When families are in crisis, we help them rebuild trust. Create stronger bonds. We create brighter futures for kids, for families, for communities. Kids need us. They need you. Together, we'll make an even bigger difference.\n\n\n###MON###\n###COL###",,www.chsfl.org,,,,
576,"THE ADVOCACY NETWORK ON DISABILITIES, INC.","CCDH, Inc.","CCDH is an advocacy organization that provides, arranges and coordinates services to adults with developmental disabilities, and to children with developmental, physical, and sensory disabilities. \n\nMiami-DadeGÇÖs lead agency advocating, planning, providing, coordinating and arranging for services benefitting people with developmental and other disabilitiesGÇª\n\nTHE ADVOCACY NETWORK ON DISABILITIES champions the rights of individuals with intellectual, developmental, and other disabilities by promoting inclusion, providing services, and advancing systems change. Miami-DadeGÇÖs lead agency advocating, planning, providing, coordinating and arranging for services benefiting people with developmental and other disabilities.\n\nServices include:\n\n* Individual Advocacy and Case Management\n* Stipends for In-Home Supports\n* Legislative & Public Policy Advocacy\n* Training and Technical Assistance to increase the capacity of community programs to include children with disabilities\n* Funding for Wheelchair Repairs for children\n* Professional Development and Training",,www.advocacynetwork.org,,,,
583,THE COUNSELING GROUP,,"The Counseling Group is dedicated to providing you and your loved ones with the personal care you deserve for your emotional needs. The Counseling Group staff works with children, adolescents and adults and offers individual, couple and family consultations as well as group therapy sessions.",,www.counselinggroupmiami.com,,,,
587,BORINQUEN MEDICAL CENTERS OF MIAMI-DADE,,Borinquen Medical Centers of Miami-Dade provide a comprehensive range of health and social services to our culturally diverse community in Miami-Dade County. \n\nServices include:\n* Internal Medicine\n* Dental\n* OB/GYN\n* Pediatrics\n* X-Rays\n* Outreach (STD Testing)\n* Assisted Pregnancy \n* Healthy Start\n* Registration Department\n* Labs\n* Senior Service Center\n* Ultrasounds\n* Medical Records\n* Medicaid Eligibility,,www.borinquenhealth.org,,,,
594,KAYLEEN'S LEARNING CENTER,,"At Kayleen's Learning Center, we dedicate ourselves to creating a program that meets the needs and promotes the growth of our children, parents and staff. As an extension of the family, we provide an environment that is nurturing, warm, clean, safe and caring. We offer the opportunity for children to make choices that will enhance their naturally emerging skills.\n\nWe feature an academically rich developmentally appropriate curriculum, which focuses on the individual skill and interest of our children. Through the use of our unique program, we encourage curiosity, exploration, independent, thinking and discovery. Kayleen's Learning Center promote continuity and bonding among the child, the teacher and the parent.\n\nEnrichment programs are an important component at Kayleen's Learning Center curriculum. Our academic program is enhanced with music, computers and creative movement.\n\nOur teachers are skilled, educated professionals, chosen for their sensitivity to the needs and ideas of the children. Our ongoing unique training program offers teachers an exceptional opportunity to continually upgrade their skills and knowledge of child development.\n\nIt is our goal for the children that enter our program to leave knowing they are unique, capable and creative individuals who have the tools to explore their world and their role in it.",,,,,,
750,"RONALD MCDONALD HOUSE CHARITIES OF SOUTH FLORIDA, INC.",,"Provides a ""home away from home"" for parents with a child who is receiving hospital treatment at JMH or surrounding area hospitals. There are 31 rooms with semi-private baths, a kitchen and laundry room.",,www.rmhcsouthflorida.org,,,,
752,RESPECT LIFE,Pregnancy Help,"Provides free pregnancy tests, limited ultrasounds to pregnant and new mothers, free counseling, support groups and material assistance (diapers, baby food, clothing) to pregnant women who may be contemplating abortion. All services are free and confidential.",,http://www.pregnancyhelp.me/,,,,
759,CAREERSOURCE SOUTH FLORIDA,Formerly known as South Florida Workforce,"The CareerSource South Florida funds and oversees workforce development programs for the Miami-Dade and Monroe region. It receives training funds for the South Florida region from the State of Florida. Provides services to people seeking employment, with listings of employment opportunities in the private sector, as well as public service opportunities with local governments, state and federal. Also administers Unemployment Compensation Insurance Claims and offers employment counseling, testing and training referrals for the general public.\n\n\n###MON###",,www.careersourcesfl.com/,,,,
773,"THE TRUE DELIVERANCE CHURCH OF CHRIST, INC.",,"household items such as, clothing, soap, deodorant, etc. are available for a discounted price.",,,,,,
775,"UNITED THERAPISTS OF SOUTH FLORIDA, LLC.",,"Provides psychotherapy to families, individuals and couples regarding numerous issues. Underserved communities, such as the LGBT community and communities of color will specifically find their needs to be met. All populations are served.",,www.unitedtherapistsofsouthflorida.com,,,,
777,PASS IT ON MINISTRIES - EMERGENCY FOOD PROGRAM,,"Agency provides emergency food, clothing and networks with other agencies to help resolve problems.\n\nHelp is given on emergency basis, ONCE EVERY YEAR. If client has received help from them before, they must be in an extreme emergency situation to receive help again; if they receive help a second time, they will only receive a Care Package (bread and pastries).",,https://passitonministries.net/,,,,
