id,name,alternate_name,description,email,url,tax_status,tax_id,year_incorporated,legal_status
3347,"PSYCHSOLUTIONS, INC.",,"PsychSolutions uses an on-site model to provide a full range of therapeutic services to children in various settings: Biological homes, foster homes, shelters, schools, day cares, juvenile justice facilities, detention centers, residential programs, and in the office. \n\nServices provided include:\n\n* Cooperative agreement with Miami-Dade Public Schools.   \n* Provides individual and family therapy.  \n* Psychiatric evaluation and medication management.  \n* Mental Health Targeted Case Management.  \n* On-site therapeutic services provided in school sites.\n* Substance abuse and testing.\n* Trauma specialists/clinicians and Problematic Sexual Behaviors.",,www.psychsolutionsinc.net,,,,
3349,"NEAT STUFF, INC.",,"Provides new clothing, shoes, etc. free of charge to abused, neglected and homeless children in shelters and foster care.",,www.neatstuffhelpkids.org,,,,
3538,"MARINERS HOSPITAL, INC.",,"Mariners Hospital is a 25-inpatient bed critical access hospital located in Tavernier, Florida and is part of Baptist Health South Florida. It has 42 all-private patient rooms, which includes a medical-surgical unit, an intensive care unit, and outpatient surgery. The Emergency Center has five treatment rooms, plus a trauma room that can treat two patients at once, if needed, and an orthopedic trauma room, used for casting broken bones and prepping patients for surgery.\n\nServices provided include:\nCancer Services, Cardiovascular Services, Diabetes Care, Diagnostic Imaging, Mammography, Endoscopy, Hyperbaric Services, Intensive Care Unit (ICU), Laboratory Services, Pulmonary Services, Pastoral Care, Physical & Speech Therapy, Radiation Therapy, Rehabilitation Services, Surgery, Sleep Diagnostics, Spine Care, Stroke, Swing Bed Services, Wound Care, Wellness Center.\n\n###MON###",,https://baptisthealth.net/en/facilities/mariners-hospital/pages/mariners.aspx,,,,
3543,"UNITED HEALTHCARE CHILDREN'S FOUNDATION, INC.",,"The United Healthcare ChildrenGÇÖs Foundation (UHCCF) is a 501(c)(3) charitable organization that provides medical grants to help children gain access to health-related services not covered, or not fully covered, by their parentsGÇÖ commercial health insurance plan.\n\nFamilies can receive up to $5,000 annually per child ($10,000 lifetime maximum per child), and do not need to have insurance through United Healthcare to be eligible.\n\n\n###MON###\n###COL###",,www.uhccf.org,,,,
3545,U.S. FISH AND WILDLIFE SERVICES,,"The U.S. Fish & Wildlife Services works with others to conserve, protect and enhance fish, wildlife and plants and their habitats for the continuing benefit of the American people.\n\n###COL###\n###MON###",,www.fws.gov,,,,
3549,MONROE COUNTY NUTRITION PROGRAM,,"Has 4 locations throughout Monroe County that provides meals in a congregate setting to seniors. Also provides Meals on Wheels to those who are home-bound, elderly or disabled. Recreational activities offered at some centers.\n\n\n###MON###",,http://www.monroecounty-fl.gov/index.aspx?nid=147,,,,
3577,"MY LITTLE WORLD PRESCHOOL, INC.",,"My Little World Preschool offers affordable preschool services for early childhood. Full time and part time hours available for after school (including teacher planning days) and summer camp programs.\n\nSummer camp has a different theme each day such as cooking, sports activities, arts and crafts, water day, special visitor day and tutoring. \n\nDates: June 10th - August 16th\nRegistration will begin the first week of April.",,mylittleworldpreschools.com,,,,
3579,FLORIDA DEPARTMENT OF ECONOMIC OPPORTUNITY,Formerly the Florida Institute for Workforce Innovation,"The Florida Department of Economic Development provides assessment of the individual's skills. It provides job related services such as pre-employment skills training, vocational rehabilitation, job search and placement.\n\n###COL###\n###MON###",,http://www.floridajobs.org/,,,,
3583,"UNITED WAY 2-1-1 OF SUNCOAST, INC.",,"United Way 2-1-1 of Suncoast provides information and referral for DeSoto, Manatee & Sarasota Counties.",,www.211.gs-humanservices.org/,,,,
3585,"NOVA SOUTHEASTERN UNIVERSITY, INC.",,"Located on a 300-acre campus in Fort Lauderdale, NSU has more than 25,000 students and is the largest independent institution of higher education in Florida. Nova Southeastern University is the largest independent institution of higher education in the Southeast, and it is the 7th largest independent institution nationally. NSU awards associate's, bachelor's, master's, educational specialist, doctoral, and first-professional degrees in a wide range of fields. The university is comprised of undergraduate, graduate and professional schools of osteopathic medicine, pharmacy, optometry, allied health and nursing, medical sciences, dental medicine, law, marine biology and oceanography, business and entrepreneurship, computer and information sciences, humanities, conflict resolution, family therapy, interdisciplinary studies, education, psychology and counseling, and family programs.",,www.nova.edu,,,,
3595,FLORIDA KEYS COMMUNITY COLLEGE,,"This institution provides 2-year degrees leading to Associates in Science/Arts, as well as certificate programs and non-credit courses. Also offers academic counseling, career planning, and student financial aid.",,www.fkcc.edu,,,,
3599,BARRY UNIVERSITY,,"Barry University offers undergraduate and graduate degree programs in adult and continuing education, arts and sciences, business, communication, education, graduate medical sciences, human performance and leisure sciences, law, natural and health sciences, nursing, psychology, social work and theology. Also offers a High School Equivalency Program.",,www.barry.edu,,,,
3601,UNITED WAY 2-1-1 NORTH CENTRAL FLORIDA,,"United Way 211 for North Central Florida provides information and referrals to community resources including human service agencies, community clubs, interest groups, support groups, government services, recreation and education programs and health resources. Call center is answered by Heart of Florida.",,www.unitedwayncfl.org,,,,
3603,"DOMESTIC ABUSE SHELTER OF THE FLORIDA KEYS, INC.",,The Domestic Abuse Shelter is the only certified Domestic Violence Center and emergency shelter in Monroe County that provides refuge for victims of domestic  violence and their children. Residents may stay at the shelter for up to six weeks. All agency services are available to shelter residents. Residents obtain the following services:\n\n* Crisis Intervention\n* Supportive Counseling\n* Childrens Services\n* Food and Clothing\n* Support Group Counseling and Advocacy\n* 24-Hour Hotline\n* Case Management\n* Information and Referral\n* Professional Training and Community Education\n\n###MON###,,www.domesticabuseshelter.org,,,,
3610,"PEACE CDC, INC.","PEACE CDC, Esmirna Church, The Red House","Peace CDC provides after school services consists of healthy snack, homework assistance, reading, arts & crafts and physical education and social skills education. The children's reading progress is quarterly evaluated through ""oral reading fluency test"" provided by Nova University. The physical program is also evaluated by Nova University through the ""Pacer Test"". \n\nSummer camp provides reading, math, physical education, arts & crafts, outdoor activities and one weekly field trip to: Black Beard Water Park, Dave & Busters, Chuck E. Cheese, Movies, Rock Climbing, Jumparoo, etc. weather permits. Breakfast, lunch, and 1 snacks will be served daily. Will be closed on July 4th.\n\nDates: June 10th - July 26th\nRegistration will begin first week of April",,www.peacecdc.org,,,,
3616,"AH OF MONROE COUNTY, INC.","Aids Help, Inc.","AH of Monroe County, a non-profit community-based organization, provides case-managed health care, housing, food, counseling, referral, PrEP and nPEP referrals and support services for HIV-infected residents of Monroe County (the Florida Keys). The agency also conducts health education, HIV risk reduction and outreach programs aimed at reducing the impact of HIV infection throughout the County. Currently the agency owns 96 units for people not only living with AIDS/HIV, but also for those with other disabilities, low-income households, veterans, and the elderly and will be adding an additional 47 units in 2020.\n\n\n###MON###",,http://www.ahmonroe.org/,,,,
3620,MONROE COUNTY SHERIFF'S OFFICE,,"The Sheriff's Office provides law enforcement service to all of the Florida Keys, which include approximately 112 miles of islands branching off the southern tip of Florida. The main highway, U.S. 1 runs from Florida City to Key West, and in that span, there are 45 bridges connecting the islands.\n\n###MON###",,www.keysso.net,,,,
3624,"RESTAURANT OPPORTUNITIES CENTERS UNITED, INC.",ROC-UNITED,"The mission of the Restaurant Opportunities Centers (ROC) United is to improve wages and working conditions for the nationGÇÖs restaurant workforce. We are 13,000 restaurant workers, 100 high-road employers, thousands of engaged consumers united for raising restaurant industry standards.\n\n###MON###\n###COL###",,www.rocunited.org,,,,
3626,"GUIDANCE/CARE-CENTER, INC.",GUIDANCE CLINIC,"Guidance/Care-Center, Inc. (GCC) provides behavioral health services, education, and support to benefit people from all incomes and walks of life.\nGCC works collaboratively with other agencies, schools, private providers, law enforcement, hospitals and other behavioral health providers to support and enhance the benefits to our clients, consumers and other stake holders.\n\n\n###MON###",,www.guidancecarecenter.org,,,,
3642,"THE SHIMMY CLUB, INC.",,"Serving as a cultural catalyst, bringing music, arts, and dance from around the world to local communities, The Shimmy Club, Inc. promotes socially-oriented activities that not only unite families within a particular cultural heritage, but also strengthen our richly diverse communities across these traditions. In keeping with its strong philosophy of inclusiveness and diversity, we offer mixed ability programming, events, activities and arts education to people with disabilities.",,www.theshimmyclub.org,,,,
3644,"CARING HOME CARE, INC.",,"Provides home care services for Miami-Dade, Broward, and Palm Beach counties. Services include personal care assistance, homemaker, escort, companionship, respite care, live in and skilled nursing care.",,www.caringhomecare.com,,,,
3646,"SURF MED, INC.",,"Provides durable medical equipment and medical supplies to Medicare, Medicaid, private insurance and self-pay patients throughout Miami-Dade and Broward counties.\n\nProvides many services including home medical equipment, oxygen (both portable and stationary). Our product categories range from wheelchairs, bath safety, CPAP devices to cushions and pillows, nutritional formulas, walkers, hospital beds, commodes, lift chairs, orthopedic products, wheelchair, hospital bed rental, etc. We demonstrate the use of all products including portable oxygen concentrators, suction pumps, glucose testing monitors, ramps, raised toilet seats, compression stockings, rollators and more.",,www.surfmed.com,,,,
3655,SUNRISE COMMUNITY,,"A private, non-for-profit organization whose mission is to provide people with disabilities the assistance and support necessary to enable them to live valued lives in the community.\n\nServices Include:\n* Adult Day Training\n* Adult Companion Services\n* Adult Day Options\n* Adult Day Health Care for Senior Citizens\n* Day Program Services\n* In-Home Support Services\n* ICF/DD (Intermediate Care Facility for the Developmentally Disabled)\n* Residential Habilitation\n* Respite Care\n* Supported Living\n* Supported Living Coaching\n* Supported Employment\n* Group Homes\n* Behavior Focus Group Homes\n* Early Education and Early Intervention Services\n* Adult and Pediatric Therapy Program\n* Child Care Services",,www.sunrisegroup.org,,,,
3670,HEALTH CARE NETWORK OF SOUTHWEST FLORIDA,"COLLIER HEALTH SERVICES, INC.","Health Care Network of Southwest Florida provides primary medical and dental care, including pediatrics. There are several offices located throughout Collier County, with one pediatric dental office that offers advanced services such as sedation and hospital based dentistry.\n\n###COL###",,www.healthcareswfl.org,,,,
3701,"LJC MORTGAGE, CORP.",,"LJC Mortgage Corp offers FHA reverse mortgages for homeowners who are 62 years and older to access the equity in their homes without ever having to make a mortgage payment. A Reverse Mortgage can be used to supplement their income, cover health care expenses, and pay off existing debt. The loan becomes due when the homeowner no longer occupies the property or passes away. At this time the homeowner's family is responsible to sell the property or refinance the property to pay off the debt. The family has one year to accomplish task.",,ljcmortgagecorp.com,,,,
3731,"READ 2 SUCCEED, INC.",,"Read2Succeed is a 501 (c) (3) non-profit organization created to provide children the necessary tools and resources to achieve academic success. Read2Succeed programs are designed to improve children's academic performance and enhance the well-being of families by helping them reach self-sufficiency.  \n\nPrograms roster includes an After-School Educational Enrichment Program (I 2 Can Succeed), Tutoring Services, Adult Literacy and Civic Education Program and a Family Education and Empowerment Program.",,www.r2succeed.org,,,,
3786,CITY OF SWEETWATER,,The City of Sweetwater City Hall provides many services to its residents and others in need.,,http://cityofsweetwater.fl.gov/,,,,
3788,FLORIDA 411 SUNCOM,,Provides information about governmental agencies and facilitates access to appropriate state sponsored programs. Dial 411 or 866-693-6748.\n\n###MON###\n###COL###,,http://411.myflorida.com/apps/411/tel411.public_411,,,,
3790,"ROZALYN H. PASCHAL, M.D., P.A.",,"Rozalyn H. Paschal Community Health Trust provides pediatric services for children that include preventative care, vaccinations and sick care services.",,http://www.rhpaschalmd.com/home.html,,,,
3795,MIAMI HERALD,,"The Miami Herald is a source of news, information and innovative marketing solutions in the community. Also publishes articles in Spanish in El Nuevo Herald. Services residents of Miami-Dade, Broward and Monroe counties in South Florida.\n\n\n###MON###",,www.miamiherald.com,,,,
3797,NATIONAL RESOURCE CENTER ON DOMESTIC VIOLENCE,,"The NRCDV engages with and learns from, informs and supports systems, organizations, communities, and individuals to strengthen capacity to effectively address domestic violence and intersecting issues.\n\n###COL###\n###MON###",,www.nrcdv.org,,,,
3803,U.S. DEPARTMENT OF HOMELAND SECURITY,,"The Department of Homeland Security has a vital mission: to secure the nation from the many threats we face. This requires the dedication of more than 240,000 employees in jobs that range from aviation and border security to emergency response, from cyber security analyst to chemical facility inspector. The goal is to keep America safe.\n\n###MON###\n###COL###",,www.dhs.gov/,,,,
3805,UNITED STATES DEPARTMENT OF JUSTICE,DOJ,The U.S. Department of Justice enforces the law and defends the interests of the United States according to the law; ensures public safety against threats foreign and domestic; provides federal leadership in preventing and controlling crime; seeks just punishment for those guilty of unlawful behavior; and ensures fair and impartial administration of justice for all Americans.\n\n###MON###\n###COL###,,http://www.justice.gov/,,,,
3811,"GREATER FELLOWSHIP MBC EXTENDED HANDS MINISTRY, INC.",None,"Certified non-profit organization which provide fresh groceries and nutritious produce commodities to low income residents in the community who are in need, as well as referrals for clothing assistance for individuals and families in crisis, to move from a place of instability to a place of self-sufficiency.",,http://www.cityofglorygfmbc.com/,,,,
3813,U.S. POSTAL INSPECTION SERVICE,,"The mission is to support and protect the U.S. Postal Service and its employees, infrastructure, and customers; enforce the laws that defend the nationGÇÖs mail system from illegal or dangerous use; and ensure public trust in the mail.\n\nCrimes within the purview of postal investigations include: mail fraud, the illegal transmission of controlled substances through the U.S. Mail, the mailing of child pornography, bombs or matters containing poison, unauthorized concealable firearms, harmful or prohibited articles, theft of mail or postal valuables and assaults on postal employees.",,www.usps.com/postalinspectors,,,,
3815,FEDERAL BUREAU OF INVESTIGATION (FBI),,"The F.B.I. is the primary federal agency responsible for investigating violations of federal law, protecting the nation from terrorist and foreign intelligence activities, and providing leadership and law enforcement assistance to federal, state, local and international agencies. Priorities of the FBI include: \n\n* Protecting the United States from terrorists attack, foreign intelligence operations and espionage\n* Protecting the nation against cyber-based attacks and high technology crimes\n* Combating public corruption\n* Protecting civil rights\n* Combating transnational and national criminal organizations\n* Investigating major white-collar and violent crimes.",,http://www.fbi.gov/miami/,,,,
3817,FLORIDA HIGHWAY PATROL,,The Florida Highway Patrol is responsible for patrolling all interstate highways and state roads. They enforce state and local traffic ordinances and respond to all incidents on highways and state roads. The patrol is also charged with investigating accidents and criminal occurrences.,,www.fhp.state.fl.us,,,,
3821,CENTERS FOR DISEASE CONTROL AND PREVENTION,CDC,The Centers for Disease Control and Prevention (CDC) is the national public health institute of the United States.\n\n\n###MON###\n###COL###,,www.cdc.gov/,,,,
3823,AT&T,,"AT&T offers phone service for landlines, mobile phones, and internet. In addition it sponsors the Lifeline Program (Low-income phone service).\n\n\n###MON###\n###COL###",,www.att.com/,,,,
3825,MIAMI-DADE COUNTY TAX COLLECTOR,M-DC TAX COLLECTOR,"Collects and distributes real property taxes, tourist development taxes, auto tag issuances and renewals, vessel licenses and sports licenses for fishing and hunting. Provides recorded information regarding real estate taxes, tangible business property taxes, and delinquent and current tax payments.",,www.miamidade.gov/taxcollector/,,,,
3828,MIAMI-DADE COUNTY ELECTIONS DEPARTMENT,MD-C ED,"The Elections Department, under the direction of the Supervisor of Elections, administers, prepares, conducts and tabulates in a correct, uniform and impartial manner all Federal, State, County and Municipal elections in accordance with Florida Statutes. The Department also provides election services and assistance to municipalities, School Districts, and Special Taxing Districts of Miami-Dade County.",,www.miamidade.gov/elections,,,,
4119,"BREAKTHROUGH MIAMI, INC.",,"Breakthrough Miami is an eight-year academic enrichment program. During the eight years, students attend a six-week academic program over the summer and attend Saturday programming and field trips throughout the school year. Students must apply for the program as a fourth or fifth grade student.",,www.breakthroughmiami.org,,,,
4125,"KIDS PARADISE CHILDCARE & LEARNING CENTER, INC.",,"Kids Paradise is a for-profit organization that provides services to children 0-12 years old year round. After school and summer camp programs are available to all children ages 5-12 years of age. We provide after school tutoring, daily homework assistance and social skills to the children at our program. Nutritional snacks are provided on a daily basis.",,kidsparadisechildcareinfo.com,,,,
4130,FEDERAL EMERGENCY MANAGEMENT AGENCY,FEMA,"The Federal Emergency Management Agency coordinates the federal government's role in preparing for, preventing, mitigating the effects of, responding to, and recovering from all domestic disasters, whether natural or man-made, including acts of terror.\n\n###COL###\n###MON###",,www.fema.gov,,,,
4168,PREGNANCY HELP MEDICAL CLINICS,,"Pregnancy Help Medical Clinic provides assistance and education to women and couples with a crisis pregnancy. They provide options with their crisis. Services consist of pregnancy tests, ultrasound, counseling, parenting classes, plan of adoption, character development, medical referral, abortion recovery, women's wellness program for those uninsured and much more. All services are free and strictly confidential.",,www.pregnancyhelpclinics.org,,,,
4181,"THE CHILDREN'S BEREAVEMENT CENTER, INC.",,"Provides comprehensive bereavement support, education and resource center for children (kindergarten - college age) and their families who have suffered a loss due to death. CBC provides peer support groups for children, teens and young adults; and concurrent education, support and advocacy groups for their families.",,www.childbereavement.org,,,,
4187,WILLIE THE BEE MAN,,Willie the Bee Man specializes in all types of bee removal.\n\n###MON###,,http://www.williethebeeman.com/,,,,
4189,"A SAFE HAVEN FOR NEWBORNS, INC.",The Gloria M. Silverio Foundation,"""Safe Haven"" is a safety net for both the mother and the newborn infant. It allows mothers, fathers or whoever is in possession of an unharmed newborn, approximately seven days old or less, to leave them at Safe Havens: any hospital, staffed fire rescue station, or staffed emergency medical service station, with no questions asked, totally anonymous, free from fear of prosecution. A Safe Haven for Newborns is dedicated to reaching pregnant girls and mothers before they reach the crisis stage, assisting them as they make their decision in the best interest of their baby and themselves. A Safe Haven for Newborns services the entire state of Florida.\n\n###COL###\n###MON###",,www.asafehavenfornewborns.com,,,,
4193,"BEST CARE NURSES REGISTRY, INC.",,"Best Care is a private, state-licensed Nurses Registry that refers high-quality, personalized home-health caregivers. Best CareGÇÖs mission is to refer caregivers who provide comprehensive, quality health care, to individuals in their own homes.\n\nServices provided include:\n\nCNA and HHA Aides: dressing, bathing, feeding, toilet assistance, vital signs, post mortem care, making beds, assisting with walking, wheelchair-bound patients, etc.\n\nLicensed Practical Nurses: collecting samples, lab tests, monitor medical equipment, monitor patients and take their vital signs.\n\nRegistered Nurses: care for the sick and injured, help to prevent disease. \n\nBaby Nurse: assist the mother with feedings, create a newborn sleep schedule, change and bathe the baby, and ensure normal development. \n\nCompanion/Sitter: runs errands, accompany client to doctor's appointments, be a friend.\n\nSurgery Post Op Care: assist with after care of surgery, attends to all patient needs wherever the patient is located.",,www.bestcare.net,,,,
4195,"EN FAMILIA, INC.",,"En Familia provides effective parenting skills training, nurturing parenting programs for the court system, educational support programs for parents and children at school, art education, family education curriculum development, marriage preparation and enrichment, domestic violence and child abuse prevention, healing sessions for families and promoting responsible fatherhood programs.",,www.enfamiliainc.org,,,,
4204,SAFETY NET TRACKING SYSTEMS,,"SafetyNet Tracking Systems provides personal locator bracelets for persons at risk of wandering or becoming lost. The bracelets can be worn 24 hours a day, 7 days a week, are waterproof and are for persons of any age. The bracelet operates on frequencies allowing quick communication to law enforcement of a lost individual and the search will begin to find them.",,www.lojacksafetynet.com,,,,
4217,"WEST MIAMI CMHC, INC.",,"West Miami CMHC provides mental health evaluations, substance abuse psychological assessments, anger management, domestic violence counseling (Batterer's Intervention Program), DUI counseling, marriage counseling, psychiatric evaluation and consultation, individual, family and group therapy and drug testing.",,http://www.westmiamicmhc.net/,,,,
4234,"FLORIDA PALMS ACADEMY, INC.",,Florida Palms Academy is a 38-bed Statewide Inpatient Psychiatric Program (SIPP) that provides treatment for youth who could benefit from intensive residential psychiatric treatment. Youth receive an individualized education curriculum while receiving therapeutic services. The average length of stay is approximately 6 months.\n\nServices provided include Trauma Informed: \n* Individual Counseling\n* Family Counseling\n* Group Therapy\n* Parent Education/Resources\n* Psychiatric Evaluations\n* Weekly Medication Management\n* Substance Abuse Treatment/Counseling\n* Therapeutic Crisis Intervention\n* Behavioral Modification\n* On-Campus Education\n* Recreational Therapy\n* 24 Hour Nursing Services\n* Medical Services\n* Certified Behavioral Analyst Assessments \n* Formalized Discharge Planning \n* Multi-Disciplinary Scripted Individualized Treatment Planning \n* Case Management,,http://floridapalmsacademy.com,,,,
