id,term,description,parent_id,taxonomy,language
630013980013392,Food,"Services for free meals, food pantries, help paying for food, food delivery, food benefits and nutrition support.\n	    	",,,
832122112723102,Work,"Services for finding and sustaining work and improving job skills and abilities. \n	    	",,,
841905613386238,Legal,"Services for legal representation, mediation, advocacy, citizenship and immigration, adoption and foster care, guardianship, civil rights and more.\n	    	",,,
899387596744807,Money,"Services to help pay for housing, education, childcare, school, food and goods, financial education, tax preparation, insurance, government benefits, vouchers and more.\n	    	",,,
893915418546777,Care,"Services for animal welfare, residential caregiving, daytime caregiving, adoption & foster care, building support networks, end-of-life care and help navigating the system.\n	    	",,,
897715506052490,Transit,"Services for bus passes, transportation to school, healthcare, appointments and more. \n	    	",,,
976566727118378,Education,"Services for preschool, after-school, special education, help finding school, help paying for school, alternative education tutoring and more. \n	    	",,,
1169956847122981,Emergency,"Services for psychiatric emergencies, emergency financial assistance, immediate safety needs, disaster preparedness and disaster response. \n	    	",,,
1211420433536032,Goods,"Services for clothing, furniture, baby supplies, toys and gifts and other physical goods.\n	    	",,,
1276982655382389,"Health Conditions","Services for medical care, dental care, health education, addiction and recovery, help finding services and help paying for healthcare.\n	    	",,,
1305774265925553,Housing,"Services for emergency, short-term and long-term housing, housing advice, help finding housing and help paying for housing.\n	    	",,,
